600261,阳光照明,"股东名称：世纪阳光控股集团有限公司;持股数量：138,280,196;持股比例：36.91%","股东名称：陈森洁;持股数量：25,759,934;持股比例：6.88%","股东名称：陈月明;持股数量：18,183,268;持股比例：4.85%","股东名称：中国建设银行-国泰金鼎价值精选混合型证券投资基金;持股数量：17,015,064;持股比例：4.54%","股东名称：杭州易安投资有限公司;持股数量：14,685,090;持股比例：3.92%","股东名称：交通银行-华安策略优选股票型证券投资基金;持股数量：8,550,832;持股比例：3.15%","股东名称：浙江桢利信息科技有限公司;持股数量：9,110,635;持股比例：2.43%","股东名称：上虞市沥海镇集体资产经营公司;持股数量：6,466,683;持股比例：1.73%","股东名称：全国社保基金一零六组合;持股数量：4,380,358;持股比例：1.17%","股东名称：中信实业银行-建信恒久价值股票型证券投资基金;持股数量：4,149,417;持股比例：1.11%"
600262,北方股份,"股东名称：内蒙古北方重工业集团有限公司;持股数量：60,245,160;持股比例：35.44%","股东名称：TEREX EQUIPMENT LIMITED;持股数量：42,780,000;持股比例：25.16%","股东名称：中国银行-嘉实主题精选混合型证券投资基金;持股数量：5,018,761;持股比例：2.95%","股东名称：中国工商银行-诺安价值增长股票证券投资基金;持股数量：4,124,083;持股比例：2.43%","股东名称：中国工商银行股份有限公司-诺安中小盘精选股票型证券投资基金;持股数量：3,643,921;持股比例：2.14%","股东名称：中信证券-建行-中信证券股债双赢集合资产管理计划;持股数量：2,700,008;持股比例：1.59%","股东名称：中国建设银行-工银瑞信稳健成长股票型证券投资基金;持股数量：1,524,700;持股比例：0.9%","股东名称：通乾证券投资基金;持股数量：1,000,000;持股比例：0.59%","股东名称：温宇;持股数量：668,138;持股比例：0.39%","股东名称：李雪鹏;持股数量：582,199;持股比例：0.34%"
600263,路桥建设,"","","","","","","","","",""
600265,*ST景谷,"股东名称：景谷森达国有资产经营有限责任公司;持股数量：32,026,748;持股比例：24.67%","股东名称：中泰信用担保有限公司;持股数量：31,702,700;持股比例：24.42%","股东名称：景谷傣族彝族自治县电力有限责任公司;持股数量：1,338,200;持股比例：1.03%","股东名称：王坚宏;持股数量：976,300;持股比例：0.75%","股东名称：胡丁;持股数量：698,319;持股比例：0.54%","股东名称：广发证券股份有限公司客户信用交易担保证券账户;持股数量：480,632;持股比例：0.37%","股东名称：范琳;持股数量：453,011;持股比例：0.35%","股东名称：张瑞香;持股数量：444,960;持股比例：0.34%","股东名称：北京道杰士投资咨询服务有限责任公司;持股数量：386,027;持股比例：0.3%","股东名称：张美玲;持股数量：376,213;持股比例：0.29%"
600266,北京城建,"股东名称：北京城建集团有限责任公司;持股数量：448,240,936;持股比例：50.41%","股东名称：中国银行-工银瑞信核心价值股票型证券投资基金;持股数量：33,576,841;持股比例：3.78%","股东名称：中国农业银行-中邮核心优选股票型证券投资基金;持股数量：28,142,081;持股比例：3.16%","股东名称：中国工商银行-南方成份精选股票型证券投资基金;持股数量：25,193,139;持股比例：2.83%","股东名称：中国农业银行-富国天瑞强势地区精选混合型开放式证券投资基金;持股数量：17,666,640;持股比例：1.99%","股东名称：中国银行-嘉实稳健开放式证券投资基金;持股数量：12,792,102;持股比例：1.44%","股东名称：中国工商银行-南方稳健成长证券投资基金;持股数量：8,303,391;持股比例：0.93%","股东名称：中国工商银行-南方稳健成长贰号证券投资基金;持股数量：8,208,885;持股比例：0.92%","股东名称：中国建设银行-华夏优势增长股票型证券投资基金;持股数量：7,999,868;持股比例：0.9%","股东名称：中国建设银行-华宝兴业行业精选股票型证券投资基金;持股数量：7,600,000;持股比例：0.85%"
600267,海正药业,"股东名称：浙江海正集团有限公司;持股数量：200,489,744;持股比例：38.2%","股东名称：浙江省国际贸易集团有限公司;持股数量：56,314,497;持股比例：10.73%","股东名称：中国银行-大成财富管理2020生命周期证券投资基金;持股数量：23,500,000;持股比例：4.48%","股东名称：中国建设银行-银华核心价值优选股票型证券投资基金;持股数量：15,586,368;持股比例：2.97%","股东名称：中国人寿保险(集团)公司-传统-普通保险产品;持股数量：15,154,303;持股比例：2.89%","股东名称：上海昊益实业有限公司;持股数量：12,000,000;持股比例：2.29%","股东名称：中国银行-银华优质增长股票型证券投资基金;持股数量：9,800,000;持股比例：1.87%","股东名称：融通新蓝筹证券投资基金;持股数量：9,179,897;持股比例：1.75%","股东名称：同德证券投资基金;持股数量：7,206,345;持股比例：1.37%","股东名称：中国人寿保险股份有限公司-分红-个人分红-005L-FH002沪;持股数量：7,101,359;持股比例：1.35%"
600268,国电南自,"股东名称：国家电力公司南京电力自动化设备总厂;持股数量：324,522,056;持股比例：51.09%","股东名称：上海证券有限责任公司;持股数量：10,000,000;持股比例：1.57%","股东名称：湖南湘投金天科技集团有限责任公司;持股数量：10,000,000;持股比例：1.57%","股东名称：中国人寿保险(集团)公司-传统-普通保险产品;持股数量：9,700,090;持股比例：1.53%","股东名称：中国人寿保险股份有限公司-传统-普通保险产品-005L-CT001沪;持股数量：9,638,252;持股比例：1.52%","股东名称：太平人寿保险有限公司-传统-普通保险产品-022L-CT001沪;持股数量：8,000,000;持股比例：1.26%","股东名称：中诚信托有限责任公司;持股数量：8,000,000;持股比例：1.26%","股东名称：天平汽车保险股份有限公司-自有资金;持股数量：8,000,000;持股比例：1.26%","股东名称：江苏开元股份有限公司;持股数量：6,766,232;持股比例：1.07%","股东名称：平安证券有限责任公司;持股数量：6,766,232;持股比例：1.07%"
600269,赣粤高速,"股东名称：江西省高速公路投资集团有限责任公司;持股数量：1,213,856,322;持股比例：51.98%","股东名称：中国建设银行-鹏华价值优势股票型证券投资基金;持股数量：21,999,917;持股比例：0.94%","股东名称：中国银行-海富通股票证券投资基金;持股数量：17,909,811;持股比例：0.77%","股东名称：深圳吉富创业投资股份有限公司;持股数量：14,881,070;持股比例：0.64%","股东名称：中国建设银行-华夏红利混合型开放式证券投资基金;持股数量：9,065,041;持股比例：0.39%","股东名称：江西公路开发总公司;持股数量：7,379,960;持股比例：0.32%","股东名称：中国农业银行-景顺长城内需增长贰号股票型证券投资基金;持股数量：7,197,759;持股比例：0.31%","股东名称：中国工商银行-南方成份精选股票型证券投资基金;持股数量：7,047,700;持股比例：0.3%","股东名称：中国建设银行股份有限公司-海富通领先成长股票型证券投资基金;持股数量：6,804,328;持股比例：0.29%","股东名称：中国平安人寿保险股份有限公司-传统-普通保险产品;持股数量：5,921,069;持股比例：0.25%"
600270,外运发展,"股东名称：中国外运股份有限公司;持股数量：574,637,796;持股比例：63.46%","股东名称：中国机械进出口(集团)有限公司;持股数量：26,521,745;持股比例：2.93%","股东名称：北京首都旅游股份有限公司;持股数量：5,893,721;持股比例：0.65%","股东名称：陈经建;持股数量：3,200,000;持股比例：0.35%","股东名称：国际金融-汇丰-JPMORGANCHASEBANK,NATIONALASSOCIATION;持股数量：2,158,000;持股比例：0.24%","股东名称：北京首都农业集团有限公司;持股数量：1,944,928;持股比例：0.21%","股东名称：张艳霞;持股数量：1,824,233;持股比例：0.2%","股东名称：陆宏伟;持股数量：1,751,337;持股比例：0.19%","股东名称：束志敏;持股数量：1,616,013;持股比例：0.18%","股东名称：张玉霞;持股数量：1,283,491;持股比例：0.14%"
600271,航天信息,"股东名称：中国航天科工集团公司;持股数量：370,074,086;持股比例：40.07%","股东名称：中国航天海鹰机电技术研究院;持股数量：30,908,439;持股比例：3.35%","股东名称：北京市爱威电子技术公司;持股数量：25,747,512;持股比例：2.79%","股东名称：华商盛世成长股票型证券投资基金;持股数量：20,466,814;持股比例：2.22%","股东名称：大成蓝筹稳健证券投资基金;持股数量：19,803,524;持股比例：2.14%","股东名称：华商策略精选灵活配置混合型证券投资基金;持股数量：19,314,179;持股比例：2.09%","股东名称：富国天益价值证券投资基金;持股数量：18,418,469;持股比例：1.99%","股东名称：中国人寿保险股份有限公司-分红-个人分红-005L-FH002沪;持股数量：18,189,136;持股比例：1.97%","股东名称：富国天博创新主题股票型证券投资基金;持股数量：18,150,897;持股比例：1.97%","股东名称：中信证券股份有限公司;持股数量：17,266,771;持股比例：1.87%"
600272,开开实业,"股东名称：上海开开(集团)有限公司;持股数量：33,407,762;持股比例：13.75%","股东名称：上海市国有资产监督管理委员会;持股数量：31,002,021;持股比例：12.76%","股东名称：上海静安国有资产经营有限公司;持股数量：6,000,000;持股比例：2.47%","股东名称：陈燕玲;持股数量：3,445,892;持股比例：1.42%","股东名称：上海金兴贸易公司;持股数量：3,000,000;持股比例：1.23%","股东名称：朱定阳;持股数量：2,416,236;持股比例：0.99%","股东名称：中信证券股份有限公司客户信用交易担保证券账户;持股数量：1,008,900;持股比例：0.42%","股东名称：上海九百(集团)有限公司;持股数量：880,000;持股比例：0.36%","股东名称：陈嘉伟;持股数量：827,570;持股比例：0.34%","股东名称：上海现代建筑设计(集团)有限公司;持股数量：795,146;持股比例：0.33%"
600273,华芳纺织,"股东名称：华芳集团有限公司;持股数量：160,540,000;持股比例：50.97%","股东名称：陈秀尊;持股数量：6,553,925;持股比例：2.08%","股东名称：王秀华;持股数量：4,807,669;持股比例：1.53%","股东名称：李倩倩;持股数量：2,075,000;持股比例：0.66%","股东名称：苏涛;持股数量：1,554,556;持股比例：0.49%","股东名称：陈欢庆;持股数量：1,243,300;持股比例：0.39%","股东名称：吴丽芳;持股数量：1,027,476;持股比例：0.33%","股东名称：严正芳;持股数量：842,999;持股比例：0.27%","股东名称：平安信托有限责任公司-睿富二号;持股数量：670,000;持股比例：0.21%","股东名称：陈朝晖;持股数量：617,500;持股比例：0.2%"
600275,武昌鱼,"股东名称：北京华普产业集团有限公司;持股数量：105,671,418;持股比例：20.77%","股东名称：王晶;持股数量：5,040,750;持股比例：0.99%","股东名称：茅菊艳;持股数量：3,270,629;持股比例：0.64%","股东名称：林梅微;持股数量：2,933,809;持股比例：0.58%","股东名称：覃杰;持股数量：2,545,447;持股比例：0.5%","股东名称：陈晓云;持股数量：2,171,920;持股比例：0.43%","股东名称：顾德逵;持股数量：2,059,032;持股比例：0.41%","股东名称：鄂州市建设投资公司;持股数量：2,000,000;持股比例：0.39%","股东名称：陆叶;持股数量：1,914,031;持股比例：0.38%","股东名称：叶青芳;持股数量：1,857,690;持股比例：0.37%"
600276,恒瑞医药,"股东名称：连云港天宇投资有限公司;持股数量：274,813,050;持股比例：24.45%","股东名称：连云港达远投资有限公司;持股数量：189,284,862;持股比例：16.84%","股东名称：连云港恒创医药科技有限公司;持股数量：84,953,763;持股比例：7.56%","股东名称：中国医药工业有限公司;持股数量：59,868,856;持股比例：5.33%","股东名称：江苏金海投资有限公司;持股数量：41,625,925;持股比例：3.7%","股东名称：兴业银行股份有限公司-兴全趋势投资混合型证券投资基金;持股数量：13,000,000;持股比例：1.16%","股东名称：中国银行-富兰克林国海潜力组合股票型证券投资基金;持股数量：11,720,548;持股比例：1.04%","股东名称：中国建设银行-国泰金鼎价值精选混合型证券投资基金;持股数量：9,988,660;持股比例：0.89%","股东名称：中国工商银行-博时第三产业成长股票证券投资基金;持股数量：9,408,794;持股比例：0.84%","股东名称：中国农业银行-长城安心回报混合型证券投资基金;持股数量：8,650,444;持股比例：0.77%"
600277,亿利能源,"股东名称：亿利资源集团有限公司;持股数量：768,735,820;持股比例：85.23%","股东名称：中国建设银行-华夏红利混合型开放式证券投资基金;持股数量：3,499,943;持股比例：0.39%","股东名称：陈忠;持股数量：1,248,228;持股比例：0.14%","股东名称：伊金霍洛旗崇金泓塑料制品有限责任公司;持股数量：882,850;持股比例：0.1%","股东名称：张荷;持股数量：880,000;持股比例：0.1%","股东名称：郭峰;持股数量：731,443;持股比例：0.08%","股东名称：国信证券股份有限公司客户信用交易担保证券账户;持股数量：553,660;持股比例：0.06%","股东名称：包头市鑫利峰钢铁有限公司;持股数量：540,000;持股比例：0.06%","股东名称：唐培?;持股数量：521,000;持股比例：0.06%","股东名称：王健;持股数量：511,200;持股比例：0.06%"
600278,东方创业,"股东名称：东方国际(集团)有限公司;持股数量：290,977,689;持股比例：72.43%","股东名称：姜龙银;持股数量：1,325,000;持股比例：0.33%","股东名称：东方国际集团上海市家用纺织品进出口有限公司;持股数量：1,218,334;持股比例：0.3%","股东名称：钟旭丹;持股数量：873,112;持股比例：0.22%","股东名称：缪庆;持股数量：720,006;持股比例：0.18%","股东名称：嵇金喜;持股数量：674,708;持股比例：0.17%","股东名称：吴燕云;持股数量：650,000;持股比例：0.16%","股东名称：张波;持股数量：550,060;持股比例：0.14%","股东名称：吴国枝;持股数量：539,200;持股比例：0.13%","股东名称：薛俊;持股数量：505,000;持股比例：0.13%"
600279,重庆港九,"股东名称：重庆港务物流集团有限公司;持股数量：169,267,811;持股比例：49.48%","股东名称：重庆市万州港口(集团)有限责任公司;持股数量：37,551,267;持股比例：10.98%","股东名称：重庆市城市建设投资(集团)有限公司;持股数量：8,900,300;持股比例：2.6%","股东名称：成都铁路局;持股数量：1,335,363;持股比例：0.39%","股东名称：重庆长江轮船公司;持股数量：949,000;持股比例：0.28%","股东名称：林洁华;持股数量：724,215;持股比例：0.21%","股东名称：中国建设银行-工银瑞信精选平衡混合型证券投资基金;持股数量：682,800;持股比例：0.2%","股东名称：钱大富;持股数量：656,999;持股比例：0.19%","股东名称：陈广珠;持股数量：651,600;持股比例：0.19%","股东名称：中信建投证券有限责任公司客户信用交易担保证券账户;持股数量：628,764;持股比例：0.18%"
600280,中央商场,"股东名称：江苏地华实业集团有限公司;持股数量：42,329,002;持股比例：29.49%","股东名称：祝义材;持股数量：25,758,890;持股比例：17.94%","股东名称：南京国资商贸有限公司;持股数量：7,177,103;持股比例：5%","股东名称：中国工商银行-汇添富均衡增长股票型证券投资基金;持股数量：7,000,000;持股比例：4.88%","股东名称：中国农业银行股份有限公司-易方达消费行业股票型证券投资基金;持股数量：6,886,849;持股比例：4.8%","股东名称：江苏国盾物流投资有限公司;持股数量：6,492,275;持股比例：4.52%","股东名称：南京三胞瑞宏实业投资有限公司;持股数量：6,430,558;持股比例：4.48%","股东名称：全国社保基金一零九组合;持股数量：3,650,000;持股比例：2.54%","股东名称：中国工商银行-金泰证券投资基金;持股数量：2,500,000;持股比例：1.74%","股东名称：全国社保基金六零一组合;持股数量：2,218,460;持股比例：1.55%"
600281,太化股份,"股东名称：太原化学工业集团有限公司;持股数量：261,407,825;持股比例：50.82%","股东名称：徐妙根;持股数量：3,705,642;持股比例：0.72%","股东名称：包一晨;持股数量：3,391,522;持股比例：0.67%","股东名称：国泰君安证券股份有限公司客户信用交易担保证券账户;持股数量：2,624,900;持股比例：0.51%","股东名称：中国银行-华夏大盘精选证券投资基金;持股数量：2,239,124;持股比例：0.46%","股东名称：吴莹;持股数量：2,021,600;持股比例：0.39%","股东名称：吴晓威;持股数量：1,815,992;持股比例：0.35%","股东名称：光大证券股份有限公司客户信用交易担保证券账户;持股数量：1,786,000;持股比例：0.35%","股东名称：周梦静;持股数量：1,655,800;持股比例：0.33%","股东名称：卜剑国;持股数量：1,651,284;持股比例：0.32%"
600282,南钢股份,"股东名称：南京南钢钢铁联合有限公司;持股数量：2,190,952,457;持股比例：56.53%","股东名称：南京钢铁联合有限公司;持股数量：1,056,120,000;持股比例：27.25%","股东名称：宝钢集团有限公司;持股数量：10,650,000;持股比例：0.27%","股东名称：中国工商银行股份有限公司-富国沪深300增强证券投资基金;持股数量：6,285,400;持股比例：0.16%","股东名称：王艳丽;持股数量：4,950,000;持股比例：0.13%","股东名称：刘重志;持股数量：4,106,828;持股比例：0.11%","股东名称：南京厚友投资实业有限公司;持股数量：3,618,180;持股比例：0.09%","股东名称：上海阳厦物业管理有限公司;持股数量：3,561,635;持股比例：0.09%","股东名称：中国光大银行股份有限公司-光大保德信量化核心证券投资;持股数量：2,997,082;持股比例：0.08%","股东名称：张建宾;持股数量：2,526,056;持股比例：0.07%"
600283,钱江水利,"股东名称：中国水务投资有限公司;持股数量：72,911,553;持股比例：25.55%","股东名称：浙江省水利水电投资集团有限公司;持股数量：49,105,708;持股比例：17.21%","股东名称：浙江省水电实业公司;持股数量：16,077,044;持股比例：5.63%","股东名称：中国建设银行-华夏优势增长股票型证券投资基金;持股数量：12,215,290;持股比例：4.28%","股东名称：中国建设银行股份有限公司-华夏盛世精选股票型证券投资基金;持股数量：3,500,000;持股比例：1.23%","股东名称：中国农业银行-华夏复兴股票型证券投资基金;持股数量：1,999,947;持股比例：0.7%","股东名称：交通银行-华夏蓝筹核心混合型证券投资基金(LOF);持股数量：1,640,538;持股比例：0.58%","股东名称：UBS AG;持股数量：1,360,618;持股比例：0.48%","股东名称：李强;持股数量：1,027,608;持股比例：0.36%","股东名称：中国农业银行-华夏平稳增长混合型证券投资基金;持股数量：1,000,000;持股比例：0.35%"
600284,浦东建设,"股东名称：上海浦东发展(集团)有限公司;持股数量：94,010,959;持股比例：22.64%","股东名称：上海浦东投资经营有限公司;持股数量：24,396,000;持股比例：5.88%","股东名称：上海张桥经济发展总公司;持股数量：11,603,836;持股比例：2.79%","股东名称：中国民生银行股份有限公司-东方精选混合型开放式证券投资基金;持股数量：8,623,465;持股比例：2.08%","股东名称：中国农业银行-信诚四季红混合型证券投资基金;持股数量：6,623,988;持股比例：1.6%","股东名称：上海同济资产经营有限公司;持股数量：3,463,561;持股比例：0.83%","股东名称：国泰君安证券股份有限公司客户信用交易担保证券账户;持股数量：2,449,660;持股比例：0.59%","股东名称：华泰证券股份有限公司客户信用交易担保证券账户;持股数量：1,354,540;持股比例：0.33%","股东名称：中信信托有限责任公司-武当17期;持股数量：1,300,000;持股比例：0.31%","股东名称：谢志强;持股数量：1,211,700;持股比例：0.29%"
600285,羚锐制药,"股东名称：信阳羚锐发展有限公司;持股数量：18,954,712;持股比例：9.44%","股东名称：信阳新锐投资发展有限公司;持股数量：4,830,000;持股比例：2.41%","股东名称：中国平安人寿保险股份有限公司-投连-个险投连;持股数量：4,600,004;持股比例：2.29%","股东名称：泰康人寿保险股份有限公司-传统-普通保险产品-019L-CT001沪;持股数量：3,836,250;持股比例：1.91%","股东名称：新县鑫源贸易有限公司;持股数量：3,341,000;持股比例：1.66%","股东名称：全国社保基金一零九组合;持股数量：3,005,962;持股比例：1.5%","股东名称：交通银行-金鹰中小盘精选证券投资基金;持股数量：1,538,465;持股比例：0.77%","股东名称：熊维政;持股数量：1,480,000;持股比例：0.74%","股东名称：申银万国-浦发-申银万国宝鼎一期限额特定集合资产管理计划;持股数量：1,314,918;持股比例：0.66%","股东名称：上海复星医药产业发展有限公司;持股数量：1,181,348;持股比例：0.59%"
600286,S*ST国瓷,"","","","","","","","","",""
600287,江苏舜天,"股东名称：江苏舜天国际集团有限公司江苏舜天国际集团有限公司江苏舜天国际集团有限公司;持股数量：220,263,644;持股比例：50.43%","股东名称：中国建设银行-华夏红利混合型开放式证券投资基金;持股数量：4,087,533;持股比例：0.94%","股东名称：中国建设银行股份有限公司-华夏盛世精选股票型证券投资基金;持股数量：3,999,915;持股比例：0.92%","股东名称：中融国际信托有限公司-中融聚益1号;持股数量：3,500,752;持股比例：0.8%","股东名称：陈子晖;持股数量：2,646,100;持股比例：0.61%","股东名称：兴华证券投资基金;持股数量：2,599,894;持股比例：0.6%","股东名称：广东省广新外贸轻纺(控股)公司;持股数量：2,206,072;持股比例：0.51%","股东名称：江苏开元股份有限公司;持股数量：2,000,000;持股比例：0.46%","股东名称：梅亚辉;持股数量：1,688,799;持股比例：0.39%","股东名称：中国外运江苏公司;持股数量：1,613,837;持股比例：0.37%"
600288,大恒科技,"股东名称：中国新纪元有限公司;持股数量：150,800,000;持股比例：34.52%","股东名称：全国社保基金一零七组合;持股数量：2,000,000;持股比例：0.46%","股东名称：中国农业银行股份有限公司-新华优选分红混合型证券投资基金;持股数量：1,810,000;持股比例：0.41%","股东名称：彭剑辉;持股数量：1,715,000;持股比例：0.39%","股东名称：周金水;持股数量：1,573,528;持股比例：0.36%","股东名称：中国建设银行股份有限公司-长城景气行业龙头灵活配置混合型证券投资基金;持股数量：1,350,000;持股比例：0.31%","股东名称：张兰凤;持股数量：1,304,300;持股比例：0.3%","股东名称：中国人寿保险股份有限公司-分红-个人分红-005L-FH002沪;持股数量：1,222,489;持股比例：0.28%","股东名称：张丽华;持股数量：1,000,400;持股比例：0.23%","股东名称：何奇泽;持股数量：956,167;持股比例：0.22%"
