600540,新赛股份,"股东名称：新疆艾比湖农工商联合企业总公司;持股数量：149,817,832;持股比例：49.49%","股东名称：中国银行-嘉实主题精选混合型证券投资基金;持股数量：7,949,611;持股比例：2.63%","股东名称：中国工商银行-开元证券投资基金;持股数量：4,964,853;持股比例：1.64%","股东名称：新疆生产建设兵团农五师农业生产资料公司;持股数量：1,393,724;持股比例：0.46%","股东名称：中国工商银行-南方隆元产业主题股票型证券投资基金;持股数量：1,311,201;持股比例：0.43%","股东名称：刘冬;持股数量：585,000;持股比例：0.19%","股东名称：高如茂;持股数量：552,540;持股比例：0.18%","股东名称：李昂;持股数量：448,822;持股比例：0.15%","股东名称：姚凤春;持股数量：375,000;持股比例：0.12%","股东名称：胡光宇;持股数量：340,270;持股比例：0.11%"
600543,莫高股份,"股东名称：甘肃黄羊河农工商(集团)有限责任公司;持股数量：42,729,215;持股比例：13.31%","股东名称：甘肃省农垦集团有限责任公司;持股数量：26,963,636;持股比例：8.4%","股东名称：甘肃省国营八一农场;持股数量：19,687,266;持股比例：6.13%","股东名称：五矿国际信托有限公司;持股数量：7,300,000;持股比例：2.27%","股东名称：中国建设银行-银华-道琼斯88精选证券投资基金;持股数量：5,999,776;持股比例：1.87%","股东名称：青海四维信用担保有限公司;持股数量：3,485,993;持股比例：1.09%","股东名称：葛志刚;持股数量：2,100,000;持股比例：0.65%","股东名称：中国太平洋人寿保险股份有限公司-分红-个人分红;持股数量：2,031,080;持股比例：0.63%","股东名称：虞晓红;持股数量：2,004,475;持股比例：0.62%","股东名称：上海同沃投资管理咨询有限公司;持股数量：1,316,410;持股比例：0.41%"
600545,新疆城建,"股东名称：乌鲁木齐国有资产经营有限公司;持股数量：179,472,899;持股比例：26.56%","股东名称：新疆友好集团股份有限公司;持股数量：11,643,045;持股比例：1.72%","股东名称：中国太平洋人寿保险股份有限公司-分红-个人分红;持股数量：10,516,779;持股比例：1.56%","股东名称：乌鲁木齐城市建设投资有限公司;持股数量：3,122,139;持股比例：0.46%","股东名称：中国农业银行股份有限公司-南方中证500指数证券投资基金;持股数量：1,464,247;持股比例：0.22%","股东名称：许少红;持股数量：1,350,000;持股比例：0.2%","股东名称：北京恒融嘉业投资顾问有限公司;持股数量：1,300,000;持股比例：0.19%","股东名称：北京天思彩虹机械技术有限公司;持股数量：1,210,970;持股比例：0.18%","股东名称：李占刚;持股数量：1,200,000;持股比例：0.18%","股东名称：徐建军;持股数量：1,162,917;持股比例：0.17%"
600546,山煤国际,"股东名称：山西煤炭进出口集团有限公司;持股数量：569,266,215;持股比例：57.43%","股东名称：国泰基金公司-工行-山西信托有限责任公司;持股数量：48,739,976;持股比例：4.87%","股东名称：中国东方资产管理公司;持股数量：24,000,000;持股比例：2.42%","股东名称：宁波青春投资有限公司;持股数量：23,700,000;持股比例：2.39%","股东名称：中国人寿保险(集团)公司-传统-普通保险产品;持股数量：23,000,000;持股比例：2.32%","股东名称：全国社保基金一零二组合;持股数量：17,400,000;持股比例：1.76%","股东名称：全国社保基金五零二组合;持股数量：14,000,000;持股比例：1.41%","股东名称：中国人民财产保险股份有限公司-传统-普通保险产品-008C-CT001沪;持股数量：12,968,944;持股比例：1.31%","股东名称：兴业银行股份有限公司-兴全趋势投资混合型证券投资基金;持股数量：12,000,000;持股比例：1.21%","股东名称：天津六禾碧云股权投资基金合伙企业(有限合伙);持股数量：10,228,070;持股比例：1.03%"
600547,山东黄金,"股东名称：山东黄金集团有限公司;持股数量：715,097,736;持股比例：50.25%","股东名称：山东黄金集团青岛黄金有限公司;持股数量：16,054,672;持股比例：1.13%","股东名称：中国工商银行-南方隆元产业主题股票型证券投资基金;持股数量：12,378,917;持股比例：0.87%","股东名称：交通银行-易方达50指数证券投资基金;持股数量：10,022,246;持股比例：0.7%","股东名称：中国工商银行-上证50交易型开放式指数证券投资基金;持股数量：7,562,053;持股比例：0.53%","股东名称：新华人寿保险股份有限公司-分红-团体分红-018L-FH001沪;持股数量：6,536,668;持股比例：0.46%","股东名称：重庆国际信托有限公司-融信通系列单一信托10号;持股数量：6,483,985;持股比例：0.46%","股东名称：中国民生银行股份有限公司-华商领先企业混合型证券投资基金;持股数量：5,941,594;持股比例：0.42%","股东名称：中信证券股份有限公司;持股数量：5,291,505;持股比例：0.37%","股东名称：中国人民人寿保险股份有限公司-分红-个险分红;持股数量：5,040,000;持股比例：0.35%"
600548,深高速,"股东名称：HKSCC Nominees Limited(注);持股数量：707,405,098;持股比例：32.44%","股东名称：新通产实业开发(深圳)有限公司;持股数量：654,780,000;持股比例：30.03%","股东名称：深圳市深广惠公路开发总公司;持股数量：411,459,887;持股比例：18.87%","股东名称：招商局华建公路投资有限公司;持股数量：87,211,323;持股比例：4%","股东名称：广东省路桥建设发展有限公司;持股数量：61,948,790;持股比例：2.84%","股东名称：Ip Kow;持股数量：11,300,000;持股比例：0.52%","股东名称：Au Siu Kwok;持股数量：11,000,000;持股比例：0.5%","股东名称：中国银行-招商先锋证券投资基金;持股数量：10,210,206;持股比例：0.47%","股东名称：Wong Kin Ping + Li Tao;持股数量：5,000,000;持股比例：0.23%","股东名称：上海国际信托有限公司-E-3501;持股数量：4,610,913;持股比例：0.21%"
600549,厦门钨业,"股东名称：福建省冶金(控股)有限责任公司;持股数量：229,176,948;持股比例：33.6%","股东名称：五矿有色金属股份有限公司;持股数量：140,374,710;持股比例：20.58%","股东名称：日本联合材料株式会社;持股数量：64,132,692;持股比例：9.4%","股东名称：中信证券股份有限公司;持股数量：20,150,658;持股比例：2.95%","股东名称：广发大盘成长混合型证券投资基金;持股数量：6,500,000;持股比例：0.95%","股东名称：大成蓝筹稳健证券投资基金;持股数量：6,170,441;持股比例：0.9%","股东名称：中国人民财产保险股份有限公司-传统-普通保险产品-008C-CT001沪;持股数量：5,928,919;持股比例：0.87%","股东名称：日本三菱商事株式会社;持股数量：4,227,600;持股比例：0.62%","股东名称：福建省潘洛铁矿有限责任公司;持股数量：3,453,345;持股比例：0.51%","股东名称：濮文;持股数量：2,471,720;持股比例：0.36%"
600550,天威保变,"股东名称：保定天威集团有限公司;持股数量：704,280,640;持股比例：51.3%","股东名称：保定惠源咨询服务有限公司;持股数量：76,300,575;持股比例：5.56%","股东名称：中国人民健康保险股份有限公司-传统-普通保险产品;持股数量：12,513,498;持股比例：0.91%","股东名称：国泰君安证券股份有限公司客户信用交易担保证券账户;持股数量：5,597,066;持股比例：0.41%","股东名称：中国银行-嘉实沪深300指数证券投资基金;持股数量：3,756,442;持股比例：0.27%","股东名称：BILL & MELINDA GATES FOUNDATION TRUST;持股数量：3,068,529;持股比例：0.22%","股东名称：中国银河证券股份有限公司客户信用交易担保证券账户;持股数量：2,896,600;持股比例：0.21%","股东名称：中国工商银行股份有限公司-华夏沪深300指数证券投资基金;持股数量：2,488,385;持股比例：0.18%","股东名称：姜波;持股数量：2,239,013;持股比例：0.16%","股东名称：海通证券股份有限公司客户信用交易担保证券账户;持股数量：2,049,251;持股比例：0.15%"
600551,时代出版,"股东名称：安徽出版集团有限责任公司;持股数量：294,496,041;持股比例：58.22%","股东名称：中科大资产经营有限责任公司;持股数量：46,140,982;持股比例：9.12%","股东名称：合肥科聚高技术有限责任公司;持股数量：9,982,541;持股比例：1.97%","股东名称：中国农业银行-景顺长城内需增长贰号股票型证券投资基金;持股数量：8,024,567;持股比例：1.59%","股东名称：平安信托有限责任公司-睿富二号;持股数量：7,200,000;持股比例：1.42%","股东名称：安徽省技术进出口股份有限公司;持股数量：6,054,700;持股比例：1.2%","股东名称：百年化妆护理品有限公司;持股数量：6,000,000;持股比例：1.19%","股东名称：中国农业银行--景顺长城内需增长开放式证券投资基金;持股数量：4,979,985;持股比例：0.98%","股东名称：黑龙江出版集团有限公司;持股数量：4,800,000;持股比例：0.95%","股东名称：五矿集团财务有限责任公司;持股数量：4,800,000;持股比例：0.95%"
600552,方兴科技,"股东名称：安徽华光光电材料科技集团有限公司;持股数量：39,600,300;持股比例：33.85%","股东名称：中国建设银行－华夏红利混合型开放式证券投资基金;持股数量：3,066,341;持股比例：2.62%","股东名称：BILL & MELINDA GATES FOUNDATION TRUST;持股数量：3,000,330;持股比例：2.56%","股东名称：潘淑静;持股数量：887,389;持股比例：0.76%","股东名称：蚌埠玻璃工业设计研究院;持股数量：876,000;持股比例：0.75%","股东名称：浏阳优典广告事务所;持股数量：727,739;持股比例：0.62%","股东名称：陈晶;持股数量：721,391;持股比例：0.62%","股东名称：中国银行－华夏大盘精选证券投资基金;持股数量：600,000;持股比例：0.51%","股东名称：王纳新;持股数量：589,166;持股比例：0.5%","股东名称：彭桢;持股数量：567,831;持股比例：0.49%"
600553,太行水泥,"","","","","","","","","",""
600555,*ST九龙,"股东名称：海航置业控股(集团)有限公司;持股数量：179,492,000;持股比例：13.77%","股东名称：上海大新华实业有限公司;持股数量：116,928,000;持股比例：8.97%","股东名称：Ocean Garden Holdings LTD.;持股数量：109,209,525;持股比例：8.38%","股东名称：香港海航置业控股(集团)有限公司;持股数量：93,355,175;持股比例：7.16%","股东名称：浙江九龙山国际旅游开发有限公司;持股数量：77,228,844;持股比例：5.92%","股东名称：平湖九龙山海湾度假城休闲服务有限公司;持股数量：63,771,835;持股比例：4.89%","股东名称：罗启伦;持股数量：6,869,200;持股比例：0.53%","股东名称：SHENYIN WANGUO NOMINEES (H.K.) LTD.;持股数量：6,202,500;持股比例：0.48%","股东名称：李少静;持股数量：5,000,000;持股比例：0.38%","股东名称：李少凡;持股数量：4,900,000;持股比例：0.38%"
600556,*ST北生,"股东名称：中国工商银行股份有限公司广西壮族自治区分行;持股数量：35,643,106;持股比例：9.03%","股东名称：广西北生集团有限责任公司;持股数量：28,016,800;持股比例：7.1%","股东名称：北京瑞尔德嘉创业投资管理有限公司;持股数量：27,625,743;持股比例：7%","股东名称：北海腾辉商贸有限公司;持股数量：16,233,960;持股比例：4.11%","股东名称：吴鸣霄;持股数量：14,000,000;持股比例：3.55%","股东名称：中国农业银行股份有限公司广西壮族自治区分行;持股数量：9,802,070;持股比例：2.9%","股东名称：广西北生药业股份有限公司破产企业财产处置专户;持股数量：6,160,248;持股比例：2.48%","股东名称：北京桀亚莱福生物技术有限责任公司;持股数量：4,403,700;持股比例：1.12%","股东名称：周仁？;持股数量：2,744,570;持股比例：0.7%","股东名称：范文涛;持股数量：2,600,000;持股比例：0.66%"
600557,康缘药业,"股东名称：江苏康缘集团有限责任公司;持股数量：108,539,579;持股比例：25.64%","股东名称：连云港康贝尔医疗器械有限公司;持股数量：22,132,338;持股比例：5.23%","股东名称：中国农业银行-长城安心回报混合型证券投资基金;持股数量：13,000,000;持股比例：3.07%","股东名称：肖伟;持股数量：11,808,082;持股比例：2.79%","股东名称：中国平安人寿保险股份有限公司-传统-普通保险产品;持股数量：9,507,424;持股比例：2.25%","股东名称：中国工商银行股份有限公司-广发行业领先股票型证券投资基金;持股数量：9,413,615;持股比例：2.22%","股东名称：招商银行股份有限公司-光大保德信优势配置股票型证券投资基金;持股数量：9,234,388;持股比例：2.18%","股东名称：中国建设银行-信达澳银领先增长股票型证券投资基金;持股数量：7,897,820;持股比例：1.87%","股东名称：中国光大银行股份有限公司-国投瑞银景气行业证券投资基金;持股数量：7,140,219;持股比例：1.69%","股东名称：中国平安财产保险股份有限公司-传统-普通保险产品;持股数量：6,872,149;持股比例：1.62%"
600558,大西洋,"股东名称：四川大西洋集团有限责任公司;持股数量：51,412,910;持股比例：37.21%","股东名称：四川汉龙(集团)有限公司;持股数量：1,506,000;持股比例：1.09%","股东名称：广汉市佳德实业有限公司;持股数量：1,370,000;持股比例：0.99%","股东名称：何建文;持股数量：830,000;持股比例：0.6%","股东名称：四川汉龙高新技术开发有限公司;持股数量：800,000;持股比例：0.58%","股东名称：四川省国际信托投资公司;持股数量：681,449;持股比例：0.49%","股东名称：杨文;持股数量：564,300;持股比例：0.41%","股东名称：中国银河证券股份有限公司客户信用交易担保证券账户;持股数量：559,859;持股比例：0.41%","股东名称：四川西南航空美盛投资顾问有限公司;持股数量：505,559;持股比例：0.37%","股东名称：王晓琴;持股数量：500,000;持股比例：0.36%"
600559,老白干酒,"股东名称：河北衡水老白干酿酒(集团)有限公司;持股数量：50,548,139;持股比例：36.11%","股东名称：衡水京安集团有限公司;持股数量：6,882,579;持股比例：4.92%","股东名称：全国社保基金一零九组合;持股数量：5,110,500;持股比例：3.65%","股东名称：交通银行-科瑞证券投资基金;持股数量：5,019,356;持股比例：3.59%","股东名称：中国工商银行-宝盈泛沿海区域增长股票证券投资基金;持股数量：3,942,027;持股比例：2.82%","股东名称：中国工商银行-易方达价值成长混合型证券投资基金;持股数量：3,825,597;持股比例：2.73%","股东名称：中国农业银行-国泰金牛创新成长股票型证券投资基金;持股数量：2,628,714;持股比例：1.88%","股东名称：中国银行-易方达积极成长证券投资基金;持股数量：2,300,000;持股比例：1.64%","股东名称：中国工商银行-国投瑞银核心企业股票型证券投资基金;持股数量：2,142,732;持股比例：1.53%","股东名称：银丰证券投资基金;持股数量：2,047,949;持股比例：1.46%"
600560,金自天正,"股东名称：冶金自动化研究设计院;持股数量：65,707,350;持股比例：44.07%","股东名称：中国建设银行-华夏红利混合型开放式证券投资基金;持股数量：4,114,832;持股比例：2.76%","股东名称：中国农业银行股份有限公司-博时创业成长股票型证券投资基金;持股数量：3,215,114;持股比例：2.16%","股东名称：中国钢研科技集团有限公司;持股数量：3,032,933;持股比例：2.03%","股东名称：北京富丰高科技发展总公司;持股数量：2,158,350;持股比例：1.45%","股东名称：安信证券股份有限公司客户信用交易担保证券账户;持股数量：1,628,900;持股比例：1.09%","股东名称：中国农业银行-华夏复兴股票型证券投资基金;持股数量：1,309,909;持股比例：0.88%","股东名称：中国工商银行-博时精选股票证券投资基金;持股数量：1,055,396;持股比例：0.71%","股东名称：融通新蓝筹证券投资基金;持股数量：1,000,900;持股比例：0.67%","股东名称：北京市机电研究院;持股数量：981,000;持股比例：0.66%"
600561,江西长运,"股东名称：江西长运集团有限公司;持股数量：65,676,853;持股比例：35.36%","股东名称：深圳市星耀投资有限公司;持股数量：6,500,000;持股比例：3.49%","股东名称：中融人寿保险股份有限公司-万能保险产品;持股数量：5,054,249;持股比例：2.72%","股东名称：中融国际信托有限公司-融裕25号;持股数量：4,521,893;持股比例：2.43%","股东名称：江西省投资集团公司;持股数量：4,127,361;持股比例：2.22%","股东名称：中融人寿保险股份有限公司-传统保险产品;持股数量：4,036,010;持股比例：2.17%","股东名称：中融国际信托有限公司-中融恒泰一号;持股数量：2,222,695;持股比例：1.19%","股东名称：陈明;持股数量：2,156,400;持股比例：1.16%","股东名称：姚丹;持股数量：1,681,876;持股比例：0.9%","股东名称：严建新;持股数量：691,089;持股比例：0.37%"
600562,国睿科技,"股东名称：中国电子科技集团公司第十四研究所;持股数量：22,981,600;持股比例：27.33%","股东名称：高淳县国有资产经营(控股)有限公司;持股数量：3,366,871;持股比例：4%","股东名称：徐嫣婷;持股数量：3,344,700;持股比例：3.98%","股东名称：朱金妹;持股数量：2,211,590;持股比例：2.63%","股东名称：南京市投资公司;持股数量：2,162,418;持股比例：2.57%","股东名称：杨招娣;持股数量：1,964,366;持股比例：2.34%","股东名称：胡一帆;持股数量：1,329,300;持股比例：1.58%","股东名称：潘成淼;持股数量：1,323,600;持股比例：1.57%","股东名称：林华;持股数量：1,246,096;持股比例：1.48%","股东名称：陈爱红;持股数量：1,237,670;持股比例：1.47%"
600563,法拉电子,"股东名称：厦门市法拉发展总公司;持股数量：84,000,000;持股比例：37.33%","股东名称：厦门建发集团有限公司;持股数量：29,807,011;持股比例：13.25%","股东名称：交通银行-博时新兴成长股票型证券投资基金;持股数量：4,542,790;持股比例：2.02%","股东名称：中国银行-嘉实稳健开放式证券投资基金;持股数量：4,287,853;持股比例：1.91%","股东名称：中国人寿保险(集团)公司-传统-普通保险产品;持股数量：4,058,980;持股比例：1.8%","股东名称：中国建设银行-华宝兴业多策略增长证券投资基金;持股数量：3,190,301;持股比例：1.42%","股东名称：全国社保基金六零二组合;持股数量：2,499,654;持股比例：1.11%","股东名称：中国人寿保险股份有限公司-分红-个人分红-005L-FH002沪;持股数量：2,420,634;持股比例：1.08%","股东名称：中国建设银行-博时主题行业股票证券投资基金;持股数量：1,709,825;持股比例：0.76%","股东名称：全国社保基金一零三组合;持股数量：1,301,441;持股比例：0.58%"
600565,迪马股份,"股东名称：重庆东银实业(集团)有限公司;持股数量：259,312,738;持股比例：36.02%","股东名称：南京品达建材贸易有限公司;持股数量：5,337,500;持股比例：0.74%","股东名称：成都金海融投资咨询有限公司;持股数量：4,272,503;持股比例：0.59%","股东名称：董维正;持股数量：2,542,051;持股比例：0.35%","股东名称：贾海;持股数量：2,103,356;持股比例：0.29%","股东名称：南京品佳投资管理有限公司;持股数量：2,094,700;持股比例：0.29%","股东名称：张明华;持股数量：2,080,500;持股比例：0.29%","股东名称：林学平;持股数量：2,023,599;持股比例：0.28%","股东名称：费红健;持股数量：2,019,677;持股比例：0.28%","股东名称：季明华;持股数量：1,928,000;持股比例：0.27%"
600566,洪城股份,"股东名称：荆州市洪泰置业投资有限公司;持股数量：28,549,358;持股比例：20.66%","股东名称：荆州市国有资产监督管理委员会;持股数量：14,540,782;持股比例：10.52%","股东名称：郭品洁;持股数量：1,600,000;持股比例：1.16%","股东名称：黄淑媛;持股数量：800,000;持股比例：0.58%","股东名称：中国银河证券股份有限公司客户信用交易担保证券账户;持股数量：761,740;持股比例：0.55%","股东名称：徐开东;持股数量：700,000;持股比例：0.51%","股东名称：刘玮;持股数量：422,000;持股比例：0.31%","股东名称：涂燕平;持股数量：421,400;持股比例：0.3%","股东名称：曾艳斌;持股数量：414,312;持股比例：0.3%","股东名称：冯顺仙;持股数量：400,000;持股比例：0.29%"
600567,山鹰纸业,"股东名称：马鞍山山鹰纸业集团有限公司;持股数量：59,157,540;持股比例：7.83%","股东名称：马鞍山市工业投资有限责任公司;持股数量：41,666,600;持股比例：5.52%","股东名称：湖南轻盐创业投资管理有限公司;持股数量：30,000,000;持股比例：3.97%","股东名称：上海莱乐客投资管理合伙企业(有限合伙);持股数量：25,000,000;持股比例：3.31%","股东名称：安徽省投资集团有限责任公司;持股数量：22,000,000;持股比例：2.91%","股东名称：昆仑信托有限责任公司;持股数量：21,333,400;持股比例：2.82%","股东名称：江苏瑞华投资发展有限公司;持股数量：20,000,000;持股比例：2.65%","股东名称：山西证券股份有限公司;持股数量：20,000,000;持股比例：2.65%","股东名称：博弘数君(天津)股权投资基金合伙企业(有限合伙);持股数量：20,000,000;持股比例：2.65%","股东名称：林彬彬;持股数量：20,000,000;持股比例：2.65%"
600568,中珠控股,"股东名称：珠海中珠股份有限公司;持股数量：78,600,000;持股比例：47.22%","股东名称：湖北省潜江市制药厂;持股数量：5,764,680;持股比例：3.46%","股东名称：西安东盛集团有限公司;持股数量：2,400,000;持股比例：1.44%","股东名称：陈杏三;持股数量：1,506,499;持股比例：0.9%","股东名称：骆丽媛;持股数量：1,412,421;持股比例：0.85%","股东名称：陈一村;持股数量：1,251,256;持股比例：0.75%","股东名称：黄炬培;持股数量：1,205,367;持股比例：0.72%","股东名称：陈孝花;持股数量：989,900;持股比例：0.59%","股东名称：中融国际信托有限公司-融新163号资金信托合同;持股数量：966,000;持股比例：0.58%","股东名称：付方贤;持股数量：900,000;持股比例：0.54%"
600569,安阳钢铁,"股东名称：安阳钢铁集团有限责任公司;持股数量：1,438,934,489;持股比例：60.11%","股东名称：苗进娜;持股数量：6,095,669;持股比例：0.25%","股东名称：刘爱玉;持股数量：5,373,776;持股比例：0.22%","股东名称：北京扬科利普教育咨询有限公司;持股数量：4,346,434;持股比例：0.18%","股东名称：中国建设银行-上投摩根中国优势证券投资基金;持股数量：3,798,868;持股比例：0.16%","股东名称：费立霞;持股数量：3,700,000;持股比例：0.15%","股东名称：林庆鹏;持股数量：3,448,744;持股比例：0.14%","股东名称：中国建设银行-华夏红利混合型开放式证券投资基金;持股数量：3,349,681;持股比例：0.14%","股东名称：廖强;持股数量：2,736,039;持股比例：0.11%","股东名称：中国农业银行股份有限公司-南方中证500指数证券投资基金(LOF);持股数量：2,593,229;持股比例：0.11%"
600570,恒生电子,"股东名称：杭州恒生电子集团有限公司;持股数量：133,344,148;持股比例：21.38%","股东名称：华安策略优选股票型证券投资基金;持股数量：30,485,501;持股比例：4.89%","股东名称：银华核心价值优选股票型证券投资基金;持股数量：25,103,004;持股比例：4.02%","股东名称：诺安平衡证券投资基金;持股数量：17,736,419;持股比例：2.84%","股东名称：嘉实策略增长混合型证券投资基金;持股数量：17,428,059;持股比例：2.79%","股东名称：景福证券投资基金;持股数量：16,560,410;持股比例：2.65%","股东名称：周林根;持股数量：15,922,074;持股比例：2.55%","股东名称：富国天合稳健优选股票型证券投资基金;持股数量：14,524,142;持股比例：2.33%","股东名称：大成价值增长证券投资基金;持股数量：13,526,787;持股比例：2.17%","股东名称：蒋建圣;持股数量：12,837,516;持股比例：2.06%"
