600815,厦工股份,"股东名称：厦门海翼集团有限公司;持股数量：352,262,458;持股比例：45.18%","股东名称：厦门厦工重工有限公司;持股数量：69,993,067;持股比例：8.98%","股东名称：中国农业银行-中邮核心成长股票型证券投资基金;持股数量：36,043,800;持股比例：4.62%","股东名称：中国工商银行-诺安股票证券投资基金;持股数量：14,504,259;持股比例：1.86%","股东名称：中国农业银行-中邮核心优选股票型证券投资基金;持股数量：5,188,841;持股比例：0.67%","股东名称：上海柴油机股份有限公司;持股数量：5,154,000;持股比例：0.66%","股东名称：太平人寿保险有限公司-分红-团险分红;持股数量：3,359,803;持股比例：0.43%","股东名称：三一集团有限公司;持股数量：3,333,084;持股比例：0.43%","股东名称：中海信托股份有限公司-浦江之星20号集合资金信托计划;持股数量：3,281,449;持股比例：0.42%","股东名称：古玉资本管理有限公司;持股数量：1,919,055;持股比例：0.25%"
600816,安信信托,"股东名称：上海国之杰投资发展有限公司;持股数量：149,670,672;持股比例：32.96%","股东名称：中国人寿保险(集团)公司-传统-普通保险产品;持股数量：7,078,550;持股比例：1.56%","股东名称：山西太钢投资有限公司;持股数量：6,960,138;持股比例：1.53%","股东名称：中国工商银行-富国天惠精选成长混合型证券投资基金(LOF);持股数量：4,300,081;持股比例：0.95%","股东名称：中国农业银行股份有限公司-新华优选成长股票型证券投资基金;持股数量：4,048,017;持股比例：0.89%","股东名称：中国人寿保险股份有限公司-传统-普通保险产品-005L-CT001沪;持股数量：3,432,926;持股比例：0.76%","股东名称：华宝投资有限公司;持股数量：2,945,000;持股比例：0.65%","股东名称：蒋水良;持股数量：2,700,000;持股比例：0.59%","股东名称：北京鼎问财富投资管理有限公司;持股数量：2,407,558;持股比例：0.53%","股东名称：蒋仕波;持股数量：2,213,833;持股比例：0.49%"
600817,ST宏盛,"股东名称：西安普明物流贸易发展有限公司;持股数量：33,589,968;持股比例：26.09%","股东名称：上海宏普实业投资有限公司;持股数量：5,231,016;持股比例：4.06%","股东名称：陈庆桃;持股数量：2,070,000;持股比例：1.61%","股东名称：冷晓斌;持股数量：1,467,237;持股比例：1.14%","股东名称：刘光华;持股数量：1,154,500;持股比例：0.9%","股东名称：史雪梅;持股数量：930,447;持股比例：0.72%","股东名称：上海思菲曼投资管理有限公司;持股数量：898,300;持股比例：0.7%","股东名称：樊青;持股数量：869,668;持股比例：0.68%","股东名称：张淑平;持股数量：789,900;持股比例：0.61%","股东名称：史金焕;持股数量：726,600;持股比例：0.56%"
600818,中路股份,"股东名称：上海中路(集团)有限公司;持股数量：119,252,833;持股比例：40.81%","股东名称：上海轻工控股(集团)公司;持股数量：13,642,853;持股比例：4.67%","股东名称：SHENYIN WANGUO NOMINEES (H.K.) LTDSHENYIN WANGUO NOMINEES (H.K.) LTD.;持股数量：2,103,400;持股比例：0.72%","股东名称：周海虹;持股数量：1,641,711;持股比例：0.56%","股东名称：赵伯国;持股数量：1,337,504;持股比例：0.46%","股东名称：YUANHAO GREATER CHINA FUND;持股数量：1,068,679;持股比例：0.37%","股东名称：黄莲纳;持股数量：720,000;持股比例：0.25%","股东名称：SCBHK A/C CHINA INTERNATIONAL CAPITAL CORPORATION HONG KONG SECURITIES LTD;持股数量：717,091;持股比例：0.25%","股东名称：许占方;持股数量：546,501;持股比例：0.19%",""
600819,耀皮玻璃,"股东名称：上海建筑材料(集团)总公司;持股数量：204,916,981;持股比例：28.02%","股东名称：皮尔金顿国际控股公司BV;持股数量：141,958,984;持股比例：19.41%","股东名称：中国复合材料集团有限公司;持股数量：118,934,596;持股比例：16.26%","股东名称：中国东方资产管理公司;持股数量：14,601,855;持股比例：2%","股东名称：中国工商银行-广发大盘成长混合型证券投资基金;持股数量：14,082,500;持股比例：1.93%","股东名称：TOYO SECURITIES ASIA LTD. A/C CLIENT;持股数量：5,864,631;持股比例：0.8%","股东名称：NAITO SECURITIES CO., LTD.;持股数量：3,652,451;持股比例：0.5%","股东名称：孙文雄;持股数量：2,726,614;持股比例：0.37%","股东名称：李丽蓁;持股数量：2,538,629;持股比例：0.35%","股东名称：WANG SHANG KEE &/OR CHIN WAN LAN;持股数量：1,761,320;持股比例：0.24%"
600820,隧道股份,"股东名称：上海城建(集团)公司;持股数量：270,301,785;持股比例：36.85%","股东名称：华润深国投信托有限公司-福麟1号信托计划;持股数量：18,831,293;持股比例：2.57%","股东名称：中国人民财产保险股份有限公司-传统-普通保险产品-008C-CT001沪;持股数量：4,780,230;持股比例：0.65%","股东名称：中信建投-中信-中信建投精彩理财灵活配置集合资产管理计划;持股数量：3,250,000;持股比例：0.44%","股东名称：中国人民人寿保险股份有限公司-万能-个险万能;持股数量：3,229,461;持股比例：0.44%","股东名称：中国人民健康保险股份有限公司-传统-普通保险产品;持股数量：3,208,091;持股比例：0.44%","股东名称：上海市建设工程管理有限公司;持股数量：2,653,456;持股比例：0.36%","股东名称：江西国际信托股份有限公司-金狮110号资金信托合同;持股数量：2,400,000;持股比例：0.33%","股东名称：黄景新;持股数量：2,202,191;持股比例：0.3%","股东名称：伊厦房地产开发有限公司;持股数量：1,880,900;持股比例：0.26%"
600821,津劝业,"股东名称：天津劝业华联集团有限公司;持股数量：62,860,456;持股比例：15.1%","股东名称：天津中商联控股有限公司;持股数量：51,842,388;持股比例：12.45%","股东名称：天津发展资产管理有限公司;持股数量：10,428,148;持股比例：2.51%","股东名称：天津市国有资产经营有限责任公司;持股数量：6,920,000;持股比例：1.66%","股东名称：陈景庚;持股数量：2,873,241;持股比例：0.69%","股东名称：安徽安粮兴业有限公司;持股数量：1,670,000;持股比例：0.4%","股东名称：上海证大投资管理有限公司;持股数量：1,632,633;持股比例：0.39%","股东名称：王大庆;持股数量：1,586,044;持股比例：0.38%","股东名称：天津一商集团有限公司;持股数量：1,434,658;持股比例：0.34%","股东名称：江门市汇融贸易有限公司;持股数量：1,300,000;持股比例：0.31%"
600822,上海物贸,"股东名称：百联集团有限公司;持股数量：238,575,962;持股比例：48.1%","股东名称：张本岗;持股数量：3,316,000;持股比例：0.67%","股东名称：陈天明;持股数量：1,203,603;持股比例：0.24%","股东名称：杭州九硕实业有限公司;持股数量：1,113,300;持股比例：0.22%","股东名称：王艳;持股数量：1,098,598;持股比例：0.22%","股东名称：上海沪北物流发展有限公司;持股数量：1,098,075;持股比例：0.22%","股东名称：张祖强;持股数量：1,055,766;持股比例：0.21%","股东名称：赵宝龙;持股数量：717,300;持股比例：0.14%","股东名称：中国国际金融有限公司;持股数量：704,223;持股比例：0.14%","股东名称：凌平;持股数量：690,000;持股比例：0.14%"
600823,世茂股份,"股东名称：峰盈国际有限公司;持股数量：558,000,000;持股比例：47.67%","股东名称：上海世茂企业发展有限公司;持股数量：239,249,474;持股比例：20.44%","股东名称：上海世茂投资管理有限公司;持股数量：72,000,000;持股比例：6.15%","股东名称：中国工商银行-上投摩根内需动力股票型证券投资基金;持股数量：24,485,110;持股比例：2.09%","股东名称：中国工商银行-诺安价值增长股票证券投资基金;持股数量：23,705,845;持股比例：2.03%","股东名称：中国工商银行-易方达价值成长混合型证券投资基金;持股数量：15,500,991;持股比例：1.32%","股东名称：上海市黄浦区国有资产监督管理委员会;持股数量：14,684,850;持股比例：1.25%","股东名称：中国工商银行股份有限公司-诺安中小盘精选股票型证券投资基金;持股数量：13,080,235;持股比例：1.12%","股东名称：国泰君安-建行-香港上海汇丰银行有限公司;持股数量：10,387,492;持股比例：0.89%","股东名称：中国人寿保险股份有限公司-分红-个人分红-005L-FH002沪;持股数量：10,079,644;持股比例：0.86%"
600824,益民集团,"股东名称：上海市黄浦区国有资产监督管理委员会;持股数量：285,761,478;持股比例：39.04%","股东名称：沈宇清;持股数量：5,328,083;持股比例：0.73%","股东名称：光大证券股份有限公司;持股数量：3,424,726;持股比例：0.47%","股东名称：山西省经贸投资有限公司;持股数量：2,119,268;持股比例：0.29%","股东名称：顾颉;持股数量：1,803,598;持股比例：0.25%","股东名称：南方中证500指数证券投资基金(LOF);持股数量：1,387,744;持股比例：0.19%","股东名称：李格兰;持股数量：1,315,100;持股比例：0.18%","股东名称：金海莲;持股数量：1,300,000;持股比例：0.18%","股东名称：容城县昊源农资有限公司;持股数量：1,087,300;持股比例：0.15%","股东名称：申银万国证券股份有限公司客户信用交易担保证券账户;持股数量：1,054,321;持股比例：0.14%"
600825,新华传媒,"股东名称：上海新华发行集团有限公司;持股数量：319,533,752;持股比例：30.58%","股东名称：解放日报报业集团;持股数量：245,486,319;持股比例：23.49%","股东名称：上海中润广告有限公司;持股数量：65,298,850;持股比例：6.25%","股东名称：中国建设银行-华夏红利混合型开放式证券投资基金;持股数量：9,637,835;持股比例：0.92%","股东名称：上海九百(集团)有限公司;持股数量：8,286,480;持股比例：0.79%","股东名称：沈宇清;持股数量：5,050,300;持股比例：0.48%","股东名称：中国建设银行-上投摩根阿尔法股票型证券投资基金;持股数量：4,048,410;持股比例：0.39%","股东名称：郑创宏;持股数量：2,904,503;持股比例：0.28%","股东名称：葛海强;持股数量：2,856,295;持股比例：0.27%","股东名称：中国人民财产保险股份有限公司-传统-普通保险产品-008C-CT001沪;持股数量：2,668,608;持股比例：0.26%"
600826,兰生股份,"股东名称：上海兰生(集团)有限公司;持股数量：219,464,089;持股比例：52.17%","股东名称：顾育军;持股数量：4,054,975;持股比例：0.96%","股东名称：华润深国投信托有限公司-睿信3期证券投资集合信托;持股数量：1,660,000;持股比例：0.39%","股东名称：许世甫;持股数量：1,571,099;持股比例：0.37%","股东名称：李建雄;持股数量：1,557,623;持股比例：0.37%","股东名称：李谕霖;持股数量：1,541,569;持股比例：0.37%","股东名称：华润深国投信托有限公司-睿信证券投资集合资金信托计划;持股数量：1,420,000;持股比例：0.34%","股东名称：穆道明;持股数量：1,410,000;持股比例：0.34%","股东名称：上海开山投资有限公司;持股数量：1,400,050;持股比例：0.33%","股东名称：华润深国投信托有限公司-睿信2期证券投资集合信托;持股数量：1,400,000;持股比例：0.33%"
600827,友谊股份,"股东名称：百联集团有限公司;持股数量：749,325,570;持股比例：43.5%","股东名称：上海友谊复星(控股)有限公司;持股数量：98,921,224;持股比例：5.74%","股东名称：泰康人寿保险股份有限公司-分红-个人分红-019L-FH002沪;持股数量：25,486,197;持股比例：1.48%","股东名称：泰康人寿保险股份有限公司-万能-个险万能;持股数量：19,026,505;持股比例：1.1%","股东名称：中国工商银行-中海能源策略混合型证券投资基金;持股数量：16,552,845;持股比例：0.96%","股东名称：中国农业银行-中邮核心成长股票型证券投资基金;持股数量：14,965,000;持股比例：0.87%","股东名称：招商银行股份有限公司-光大保德信优势配置股票型证券投资基金;持股数量：14,106,346;持股比例：0.82%","股东名称：中国人寿保险股份有限公司-分红-个人分红-005L-FH002沪;持股数量：13,925,510;持股比例：0.81%","股东名称：交通银行-海富通精选证券投资基金;持股数量：12,000,000;持股比例：0.7%","股东名称：全国社保基金一零八组合;持股数量：11,500,257;持股比例：0.67%"
600828,成商集团,"股东名称：深圳茂业商厦有限公司;持股数量：293,012,210;持股比例：66.78%","股东名称：中国农业银行-景顺长城资源垄断股票型证券投资基金;持股数量：18,444,049;持股比例：4.2%","股东名称：中国工商银行-景顺长城精选蓝筹股票型证券投资基金;持股数量：9,805,083;持股比例：2.23%","股东名称：何晓阳;持股数量：9,755,400;持股比例：2.22%","股东名称：中国银行-招商先锋证券投资基金;持股数量：7,498,576;持股比例：1.71%","股东名称：中国工商银行-广发策略优选混合型证券投资基金;持股数量：7,203,763;持股比例：1.64%","股东名称：同德证券投资基金;持股数量：6,806,332;持股比例：1.55%","股东名称：中信银行-招商优质成长股票型证券投资基金;持股数量：6,157,272;持股比例：1.4%","股东名称：中国银行股份有限公司-招商行业领先股票型证券投资基金;持股数量：3,000,000;持股比例：0.68%","股东名称：久嘉证券投资基金;持股数量：2,655,577;持股比例：0.61%"
600829,三精制药,"股东名称：哈药集团有限公司;持股数量：259,913,097;持股比例：44.82%","股东名称：哈药集团股份有限公司;持股数量：173,981,257;持股比例：30%","股东名称：全国社保基金一零二组合;持股数量：8,000,000;持股比例：1.38%","股东名称：交通银行-博时新兴成长股票型证券投资基金;持股数量：3,110,931;持股比例：0.54%","股东名称：兴业证券-兴业-兴业证券玉麒麟1号集合资产管理计划;持股数量：2,263,217;持股比例：0.39%","股东名称：兴业证券-兴业-兴业证券玉麒麟2号消费升级集合资产管理计划;持股数量：2,202,312;持股比例：0.38%","股东名称：太平人寿保险有限公司-分红-团险分红;持股数量：1,650,000;持股比例：0.28%","股东名称：中国工商银行-南方绩优成长股票型证券投资基金;持股数量：1,181,366;持股比例：0.2%","股东名称：珠海市凯晨投资咨询有限公司;持股数量：921,212;持股比例：0.16%","股东名称：陈伟瑜;持股数量：861,351;持股比例：0.15%"
600830,香溢融通,"股东名称：浙江烟草投资管理有限责任公司;持股数量：54,710,381;持股比例：12.04%","股东名称：中天发展控股集团有限公司;持股数量：46,203,370;持股比例：10.17%","股东名称：浙江香溢控股有限公司;持股数量：45,000,000;持股比例：9.9%","股东名称：孙仲良;持股数量：18,998,200;持股比例：4.18%","股东名称：浙江中烟工业有限责任公司;持股数量：13,500,000;持股比例：2.97%","股东名称：宁波市郡庙企业总公司;持股数量：12,546,841;持股比例：2.76%","股东名称：中国建设银行-华夏优势增长股票型证券投资基金;持股数量：8,931,694;持股比例：1.97%","股东名称：中国建设银行股份有限公司-华夏盛世精选股票型证券投资基金;持股数量：6,799,160;持股比例：1.5%","股东名称：中国银行-华夏回报证券投资基金;持股数量：6,299,882;持股比例：1.39%","股东名称：宁波大红鹰综合经营有限公司;持股数量：5,460,000;持股比例：1.2%"
600831,广电网络,"股东名称：陕西广电网络产业集团有限公司;持股数量：203,249,114;持股比例：36.07%","股东名称：华夏大盘精选证券投资基金;持股数量：20,009,692;持股比例：3.55%","股东名称：华夏红利混合型开放式证券投资基金;持股数量：8,448,833;持股比例：1.5%","股东名称：中信信托有限责任公司-建苏723;持股数量：7,762,170;持股比例：1.38%","股东名称：华夏蓝筹核心混合型证券投资基金(LOF);持股数量：7,624,294;持股比例：1.35%","股东名称：国营黄河机器制造厂;持股数量：6,985,473;持股比例：1.24%","股东名称：华夏策略精选灵活配置混合型证券投资基金;持股数量：6,842,962;持股比例：1.21%","股东名称：全国社保基金一零七组合;持股数量：6,499,828;持股比例：1.15%","股东名称：华夏优势增长股票型证券投资基金;持股数量：5,478,540;持股比例：0.97%","股东名称：华夏复兴股票型证券投资基金;持股数量：4,009,962;持股比例：0.71%"
600832,东方明珠,"股东名称：上海广播电影电视发展有限公司;持股数量：1,440,000,000;持股比例：45.19%","股东名称：上海广播电视台;持股数量：321,411,686;持股比例：10.09%","股东名称：上海精文投资有限公司;持股数量：77,970,000;持股比例：2.45%","股东名称：上海东亚(集团)有限公司;持股数量：54,709,660;持股比例：1.72%","股东名称：上海大型活动办公室;持股数量：45,213,821;持股比例：1.42%","股东名称：上海《每周广播电视》报社;持股数量：21,018,784;持股比例：0.66%","股东名称：申银万国证券股份有限公司;持股数量：10,958,766;持股比例：0.34%","股东名称：中国银行-嘉实沪深300指数证券投资基金;持股数量：8,717,634;持股比例：0.27%","股东名称：中国工商银行股份有限公司-华夏沪深300指数证券投资基金;持股数量：6,980,000;持股比例：0.22%","股东名称：潘晴;持股数量：6,421,880;持股比例：0.2%"
600833,第一医药,"股东名称：上海新路达商业(集团)有限公司;持股数量：52,185,126;持股比例：23.39%","股东名称：百联集团有限公司;持股数量：43,277,545;持股比例：19.4%","股东名称：上海劳动保护用品商店有限公司;持股数量：3,466,232;持股比例：1.55%","股东名称：华联(集团)有限公司;持股数量：1,734,583;持股比例：0.78%","股东名称：上海达安房产开发有限公司;持股数量：1,717,716;持股比例：0.77%","股东名称：黄少明;持股数量：1,289,600;持股比例：0.58%","股东名称：上海南上海商业房地产有限公司;持股数量：1,268,467;持股比例：0.57%","股东名称：上海商投创业投资有限公司;持股数量：1,226,940;持股比例：0.55%","股东名称：上海自成钢结构工程有限公司;持股数量：903,019;持股比例：0.4%","股东名称：王忠毅;持股数量：803,800;持股比例：0.36%"
600834,申通地铁,"股东名称：上海申通地铁集团有限公司;持股数量：278,943,799;持股比例：58.43%","股东名称：上海城投控股股份有限公司;持股数量：26,074,769;持股比例：5.46%","股东名称：正德人寿保险股份有限公司-万能保险产品;持股数量：726,766;持股比例：0.15%","股东名称：路殿有;持股数量：571,151;持股比例：0.12%","股东名称：中国农业银行股份有限公司-南方中证500指数证券投资基金(LOF);持股数量：517,139;持股比例：0.11%","股东名称：聂连文;持股数量：470,600;持股比例：0.1%","股东名称：周小超;持股数量：407,400;持股比例：0.09%","股东名称：郑汉金;持股数量：398,100;持股比例：0.08%","股东名称：中国工商银行股份有限公司-广发中证500指数证券投资基金(LOF);持股数量：370,597;持股比例：0.08%","股东名称：肖长林;持股数量：370,000;持股比例：0.08%"
600835,上海机电,"股东名称：上海电气集团股份有限公司;持股数量：483,520,364;持股比例：47.28%","股东名称：平安信托有限责任公司-睿富一号;持股数量：9,900,000;持股比例：0.97%","股东名称：中国工商银行-广发稳健增长证券投资基金;持股数量：9,064,993;持股比例：0.89%","股东名称：中国工商银行股份有限公司-广发行业领先股票型证券投资基金;持股数量：7,200,000;持股比例：0.7%","股东名称：国电资本控股有限公司;持股数量：6,932,700;持股比例：0.68%","股东名称：中国工商银行-东吴嘉禾优势精选混合型开放式证券投资基金;持股数量：6,502,183;持股比例：0.64%","股东名称：DRAGON BILLION CHINA MASTER FUND;持股数量：5,879,939;持股比例：0.57%","股东名称：中国人寿保险股份有限公司-分红-个人分红-005L-FH002沪;持股数量：4,926,549;持股比例：0.48%","股东名称：中国建设银行-华夏优势增长股票型证券投资基金;持股数量：3,938,425;持股比例：0.39%","股东名称：天津泰达担保有限公司;持股数量：3,155,200;持股比例：0.31%"
600836,界龙实业,"股东名称：上海界龙集团有限公司;持股数量：82,184,987;持股比例：26.21%","股东名称：郑旭娜;持股数量：1,231,900;持股比例：0.39%","股东名称：王希明;持股数量：681,159;持股比例：0.22%","股东名称：中国农业银行股份有限公司-南方中证500指数证券投资基金(LOF);持股数量：679,404;持股比例：0.22%","股东名称：黄春芳;持股数量：645,950;持股比例：0.21%","股东名称：中国工商银行股份有限公司-广发中证500指数证券投资基金(LOF);持股数量：486,900;持股比例：0.16%","股东名称：傅文胜;持股数量：477,199;持股比例：0.15%","股东名称：吴敏娟;持股数量：457,400;持股比例：0.15%","股东名称：车振民;持股数量：450,000;持股比例：0.14%","股东名称：申银万国证券股份有限公司客户信用交易担保证券账户;持股数量：444,701;持股比例：0.14%"
600837,海通证券,"股东名称：光明食品(集团)有限公司;持股数量：482,686,582;持股比例：5.87%","股东名称：上海海烟投资管理有限公司;持股数量：416,420,568;持股比例：5.06%","股东名称：上海电气(集团)总公司;持股数量：392,474,762;持股比例：4.77%","股东名称：申能(集团)有限公司;持股数量：338,164,142;持股比例：4.11%","股东名称：上海上实(集团)有限公司;持股数量：326,569,986;持股比例：3.97%","股东名称：上海久事公司;持股数量：242,911,998;持股比例：2.95%","股东名称：上海友谊集团股份有限公司;持股数量：214,471,652;持股比例：2.61%","股东名称：文汇新民联合报业集团;持股数量：205,867,869;持股比例：2.5%","股东名称：上海兰生股份有限公司;持股数量：190,950,000;持股比例：2.32%","股东名称：辽宁能源投资(集团)有限责任公司;持股数量：159,130,342;持股比例：1.93%"
600838,上海九百,"股东名称：上海九百(集团)有限公司;持股数量：78,540,608;持股比例：19.59%","股东名称：上海市静安区土地开发控股总公司;持股数量：19,678,278;持股比例：4.91%","股东名称：上海锦迪城市建设开发有限公司;持股数量：8,106,107;持股比例：2.02%","股东名称：百联集团有限公司;持股数量：7,366,330;持股比例：1.84%","股东名称：上海国宏置业有限公司;持股数量：6,000,000;持股比例：1.5%","股东名称：上海电气(集团)总公司;持股数量：2,999,325;持股比例：0.75%","股东名称：陶方盈;持股数量：1,744,918;持股比例：0.44%","股东名称：俞雅琴;持股数量：1,726,999;持股比例：0.43%","股东名称：刘伟;持股数量：1,658,000;持股比例：0.41%","股东名称：黎少明;持股数量：1,330,000;持股比例：0.33%"
600839,四川长虹,"股东名称：四川长虹电子集团有限公司;持股数量：1,070,723,925;持股比例：23.19%","股东名称：中国建设银行股份有限公司-长盛同庆可分离交易股票型证券投资基金;持股数量：95,008,200;持股比例：2.06%","股东名称：绵阳科技城发展投资(集团)有限公司;持股数量：62,951,507;持股比例：1.36%","股东名称：中国银行股份有限公司-平安大华行业先锋股票型证券投资基金;持股数量：36,199,947;持股比例：0.78%","股东名称：中国工商银行-华安中小盘成长股票型证券投资基金;持股数量：30,000,000;持股比例：0.65%","股东名称：四川虹扬投资有限公司;持股数量：25,831,137;持股比例：0.56%","股东名称：中国银行-嘉实沪深300指数证券投资基金;持股数量：20,207,733;持股比例：0.44%","股东名称：中国农业银行-国泰金牛创新成长股票型证券投资基金;持股数量：19,394,667;持股比例：0.42%","股东名称：中国工商银行股份有限公司-华夏沪深300指数证券投资基金;持股数量：15,766,235;持股比例：0.34%","股东名称：中国银行-金鹰成份股优选证券投资基金;持股数量：14,199,821;持股比例：0.31%"
