股票代码,简称,1,2,3,4,5,6,7,8,9,10
600000,浦发银行,"股东名称：中国移动通信集团广东有限公司;持股数量：3,730,694,283;持股比例：20%","股东名称：上海国际集团有限公司;持股数量：3,157,513,917;持股比例：16.93%","股东名称：上海国际信托有限公司;持股数量：975,923,794;持股比例：5.23%","股东名称：上海国鑫投资发展有限公司;持股数量：377,101,999;持股比例：2.02%","股东名称：百联集团有限公司;持股数量：190,083,517;持股比例：1.02%","股东名称：雅戈尔集团股份有限公司;持股数量：162,000,000;持股比例：0.87%","股东名称：中国烟草总公司江苏省公司（江苏省烟草公司）;持股数量：160,880,407;持股比例：0.86%","股东名称：香港中央结算有限公司;持股数量：148,594,150;持股比例：0.8%","股东名称：上海市邮政公司;持股数量：113,141,353;持股比例：0.61%","股东名称：中国证券金融股份有限公司;持股数量：88,270,957;持股比例：0.47%"
600001,邯郸钢铁,"","","","","","","","","",""
600002,齐鲁退市,"","","","","","","","","",""
600003,ST东北高,"","","","","","","","","",""
600004,白云机场,"股东名称：广东省机场管理集团有限公司;持股数量：712,591,458;持股比例：61.96%","股东名称：DEUTSCHE BANK AKTIENGESELLSCHAFT;持股数量：12,608,705;持股比例：1.1%","股东名称：宏源证券股份有限公司客户信用交易担保证券账户;持股数量：7,603,507;持股比例：0.66%","股东名称：广州交通投资有限公司;持股数量：5,240,000;持股比例：0.46%","股东名称：前海人寿保险股份有限公司－自有资金华泰组合;持股数量：5,002,847;持股比例：0.44%","股东名称：厦门国际信托有限公司－浙商一号新型结构化证券投资集合资金信托;持股数量：3,750,463;持股比例：0.33%","股东名称：中国民航机场建设集团公司;持股数量：3,650,000;持股比例：0.32%","股东名称：国泰君安证券股份有限公司客户信用交易担保证券账户;持股数量：3,537,756;持股比例：0.31%","股东名称：华泰证券股份有限公司客户信用交易担保证券账户;持股数量：3,237,214;持股比例：0.28%","股东名称：广发证券股份有限公司客户信用交易担保证券账户;持股数量：3,052,860;持股比例：0.27%"
600005,武钢股份,"股东名称：武汉钢铁(集团)公司;持股数量：6,495,503,954;持股比例：64.35%","股东名称：中国海运(集团)总公司;持股数量：300,000,000;持股比例：2.97%","股东名称：杨瑞芬;持股数量：41,882,900;持股比例：0.42%","股东名称：廖强;持股数量：25,596,300;持股比例：0.25%","股东名称：吉富创业投资股份有限公司;持股数量：24,000,000;持股比例：0.24%","股东名称：中国银行－嘉实稳健开放式证券投资基金;持股数量：20,000,000;持股比例：0.2%","股东名称：中国工商银行－华安MSCI中国A股指数增强型证券投资基金;持股数量：18,063,051;持股比例：0.18%","股东名称：中国建设银行－华宝兴业行业精选股票型证券投资基金;持股数量：14,999,981;持股比例：0.15%","股东名称：刘佳玉;持股数量：14,545,600;持股比例：0.14%","股东名称：中国人民健康保险股份有限公司－传统－普通保险产品;持股数量：12,999,943;持股比例：0.13%"
600006,东风汽车,"股东名称：东风汽车有限公司;持股数量：1,202,000,000;持股比例：60.1%","股东名称：北京金盛阳光投资有限公司;持股数量：24,442,820;持股比例：1.22%","股东名称：西南证券股份有限公司;持股数量：17,368,101;持股比例：0.87%","股东名称：中国工商银行－南方绩优成长股票型证券投资基金;持股数量：12,114,435;持股比例：0.61%","股东名称：长江证券股份有限公司;持股数量：10,030,000;持股比例：0.5%","股东名称：东风汽车公司;持股数量：8,841,838;持股比例：0.44%","股东名称：中国人寿保险(集团)公司－传统－普通保险产品;持股数量：8,599,898;持股比例：0.43%","股东名称：李火根;持股数量：7,870,358;持股比例：0.39%","股东名称：中信信托有限责任公司－中信·稳健分层型证券投资集合资金信托计划1304D期;持股数量：7,594,775;持股比例：0.38%","股东名称：中信信托有限责任公司－稳健分层型证券投资集合资金信托计划1403C期;持股数量：7,446,893;持股比例：0.37%"
600007,中国国贸,"股东名称：中国国际贸易中心有限公司;持股数量：812,360,241;持股比例：80.65%","股东名称：YALE UNIVERSITY   ;持股数量：16,299,587;持股比例：1.62%","股东名称：MERRILL LYNCH INTERNATIONAL   ;持股数量：10,401,502;持股比例：1.03%","股东名称：中国农业银行股份有限公司－新华优选分红混合型证券投资基金    ;持股数量：9,539,187;持股比例：0.95%","股东名称：张利国;持股数量：7,278,685;持股比例：0.72%","股东名称：高瓴资本管理有限公司－HCM中国基金  ;持股数量：6,995,028;持股比例：0.69%","股东名称：高继飞;持股数量：6,599,030;持股比例：0.66%","股东名称：中国建设银行股份有限公司－新华钻石品质企业股票型证券投资基金   ;持股数量：5,488,019;持股比例：0.54%","股东名称：得克萨斯大学体系董事会－自有资金;持股数量：4,689,341;持股比例：0.47%","股东名称：张俊发;持股数量：3,937,000;持股比例：0.39%"
600008,首创股份,"股东名称：北京首都创业集团有限公司;持股数量：1,309,291,709;持股比例：59.52%","股东名称：融通新蓝筹证券投资基金;持股数量：18,000,000;持股比例：0.82%","股东名称：楼文胜;持股数量：12,135,888;持股比例：0.55%","股东名称：东方证券股份有限公司;持股数量：8,116,318;持股比例：0.37%","股东名称：全国社保基金一零六组合;持股数量：7,377,037;持股比例：0.34%","股东名称：北京高校房地产开发总公司;持股数量：6,455,000;持股比例：0.29%","股东名称：中国农业银行股份有限公司-富国中证国有企业改革指数分级证券投资基金;持股数量：6,329,020;持股比例：0.29%","股东名称：中国银行股份有限公司－嘉实沪深300交易型开放式指数证券投资基金;持股数量：6,023,313;持股比例：0.27%","股东名称：中国建设银行股份有限公司－华商价值共享灵活配置混合型发起式证券投资基金;持股数量：4,999,947;持股比例：0.23%","股东名称：中国工商银行股份有限公司－华泰柏瑞沪深300交易型开放式指数证券投资基金;持股数量：4,531,671;持股比例：0.21%"
600009,上海机场,"股东名称：上海机场（集团）有限公司;持股数量：1,026,177,895;持股比例：53.25%","股东名称：香港中央结算有限公司;持股数量：80,609,521;持股比例：4.18%","股东名称：易方达资产管理(香港)有限公司－客户资金;持股数量：40,737,676;持股比例：2.11%","股东名称：易方达资产管理(香港)有限公司－客户资金(交易所)1;持股数量：29,330,806;持股比例：1.52%","股东名称：YALE  UNIVERSITY;持股数量：17,370,433;持股比例：0.9%","股东名称：GIC PRIVATE  LIMITED;持股数量：14,302,249;持股比例：0.74%","股东名称：富达基金(香港)有限公司－客户资金;持股数量：13,106,871;持股比例：0.68%","股东名称：加拿大年金计划投资委员会－自有资金;持股数量：11,827,625;持股比例：0.61%","股东名称：易方达资产管理（香港）有限公司－客户资金（交易所）2;持股数量：11,740,394;持股比例：0.61%","股东名称：UBS？AG;持股数量：11,641,111;持股比例：0.6%"
600010,包钢股份,"股东名称：包头钢铁（集团）有限责任公司;持股数量：8,125,182,522;持股比例：50.77%","股东名称：中国长城资产管理公司;持股数量：265,229,800;持股比例：1.66%","股东名称：广发证券股份有限公司客户信用交易担保证券账户;持股数量：161,835,496;持股比例：1.01%","股东名称：招商证券股份有限公司客户信用交易担保证券账户;持股数量：159,141,479;持股比例：0.99%","股东名称：华泰证券股份有限公司客户信用交易担保证券账户;持股数量：155,896,665;持股比例：0.97%","股东名称：国泰君安证券股份有限公司客户信用交易担保证券账户;持股数量：136,224,262;持股比例：0.85%","股东名称：中国银河证券股份有限公司客户信用交易担保证券账户;持股数量：129,795,778;持股比例：0.81%","股东名称：光大证券股份有限公司客户信用交易担保证券账户;持股数量：113,372,662;持股比例：0.71%","股东名称：申银万国证券股份有限公司客户信用交易担保证券账户;持股数量：107,209,075;持股比例：0.67%","股东名称：国信证券股份有限公司客户信用交易担保证券账户;持股数量：94,191,699;持股比例：0.59%"
600011,华能国际,"股东名称：华能国际电力开发公司;持股数量：5,066,662,118;持股比例：35.14%","股东名称：香港中央结算（代理人）有限公司;持股数量：3,186,066,597;持股比例：22.09%","股东名称：中国华能集团公司*;持股数量：1,561,371,213;持股比例：10.83%","股东名称：河北建设投资集团有限责任公司;持股数量：603,000,000;持股比例：4.18%","股东名称：中国华能集团香港有限公司;持股数量：472,000,000;持股比例：3.27%","股东名称：江苏省投资管理有限责任公司;持股数量：416,500,000;持股比例：2.89%","股东名称：辽宁能源投资（集团）有限责任公司;持股数量：388,619,936;持股比例：2.69%","股东名称：福建省投资开发集团有限责任公司;持股数量：374,467,500;持股比例：2.6%","股东名称：大连市建设投资集团有限公司;持股数量：301,500,000;持股比例：2.09%","股东名称：汇丰代理人（香港）有限公司;持股数量：243,210,000;持股比例：1.69%"
600012,皖通高速,"股东名称：安徽省高速公路控股集团有限公司;持股数量：524,644,220;持股比例：31.63%","股东名称：HKSCC NOMINEES LIMITED（代理人）;持股数量：488,769,898;持股比例：29.47%","股东名称：招商局华建公路投资有限公司;持股数量：404,191,501;持股比例：24.37%","股东名称：中国银行股份有限公司－华泰柏瑞积极成长混合型证券投资基金;持股数量：10,799,183;持股比例：0.65%","股东名称：郑彩萍;持股数量：3,187,449;持股比例：0.19%","股东名称：全国社保基金四零二组合;持股数量：3,153,279;持股比例：0.19%","股东名称：中国农业银行股份有限公司－摩根士丹利华鑫量化配置股票型证券投资基金;持股数量：2,294,180;持股比例：0.14%","股东名称：兰州黄河高效农业发展有限公司;持股数量：2,000,000;持股比例：0.12%","股东名称：DEUTSCHE  BANK AKTIENGESELLSCHAFT;持股数量：1,783,697;持股比例：0.11%","股东名称：袁惠;持股数量：1,724,232;持股比例：0.1%"
600015,华夏银行,"股东名称：首钢总公司;持股数量：1,805,506,536;持股比例：20.28%","股东名称：国网英大国际控股集团有限公司;持股数量：1,623,994,960;持股比例：18.24%","股东名称：DEUTSCHE BANK LUXEMBOURG S.A.德意志银行卢森堡股份有限公司;持股数量：826,392,738;持股比例：9.28%","股东名称：DEUTSCHE
  BANK AKTIENGESELLSCHAFT德意志银行股份有限公司;持股数量：731,085,499;持股比例：8.21%","股东名称：红塔烟草（集团）有限责任公司;持股数量：389,480,000;持股比例：4.37%","股东名称：SAL.OPPENHEIM
  JR.＆CIE.KOMMANDITGESELLSCHAFT AUF AKTIEN萨尔·奥彭海姆股份有限合伙企业;持股数量：222,560,000;持股比例：2.5%","股东名称：润华集团股份有限公司;持股数量：200,800,000;持股比例：2.26%","股东名称：北京三吉利能源股份有限公司;持股数量：126,935,034;持股比例：1.43%","股东名称：上海健特生命科技有限公司;持股数量：116,438,819;持股比例：1.31%","股东名称：包头华资实业股份有限公司;持股数量：58,800,000;持股比例：0.66%"
600016,民生银行,"股东名称：香港中央结算(代理人)有限公司;持股数量：6,894,167,177;持股比例：20.19%","股东名称：安邦人寿保险股份有限公司－稳健型投资组合;持股数量：1,698,579,144;持股比例：4.97%","股东名称：安邦财产保险股份有限公司－传统产品;持股数量：1,665,225,632;持股比例：4.88%","股东名称：新希望投资有限公司;持股数量：1,600,304,190;持股比例：4.69%","股东名称：中国人寿保险股份有限公司－传统－普通保险产品－005L－CT001沪;持股数量：1,381,568,777;持股比例：4.05%","股东名称：上海健特生命科技有限公司;持股数量：1,149,732,989;持股比例：3.37%","股东名称：中国船东互保协会;持股数量：1,086,917,406;持股比例：3.18%","股东名称：东方集团股份有限公司;持股数量：1,066,764,269;持股比例：3.12%","股东名称：安邦保险集团股份有限公司－传统保险产品;持股数量：939,292,013;持股比例：2.75%","股东名称：中国泛海控股集团有限公司;持股数量：838,726,939;持股比例：2.46%"
600017,日照港,"股东名称：日照港集团有限公司;持股数量：1,263,740,123;持股比例：41.09%","股东名称：兖矿集团有限公司;持股数量：186,514,800;持股比例：6.06%","股东名称：山东高速集团有限公司;持股数量：117,000,000;持股比例：3.8%","股东名称：日照港集团岚山港务有限公司;持股数量：79,993,559;持股比例：2.6%","股东名称：淄博矿业集团有限责任公司;持股数量：72,199,200;持股比例：2.35%","股东名称：中国华融资产管理股份有限公司;持股数量：59,500,000;持股比例：1.93%","股东名称：山东钢铁集团有限公司;持股数量：40,442,288;持股比例：1.31%","股东名称：中国长城资产管理公司;持股数量：39,000,000;持股比例：1.27%","股东名称：山东海洋投资有限公司;持股数量：39,000,000;持股比例：1.27%","股东名称：中国中煤能源集团有限公司;持股数量：25,824,787;持股比例：0.84%"
600018,上港集团,"股东名称：上海市国有资产监督管理委员会;持股数量：9,284,491,490;持股比例：40.8%","股东名称：亚吉投资有限公司;持股数量：5,570,694,894;持股比例：24.48%","股东名称：上海同盛投资（集团）有限公司;持股数量：5,292,486,284;持股比例：23.26%","股东名称：上海国有资产经营有限公司;持股数量：193,235,050;持股比例：0.85%","股东名称：上海久事公司;持股数量：92,844,915;持股比例：0.41%","股东名称：上海交通投资（集团）有限公司;持股数量：29,070,000;持股比例：0.13%","股东名称：中国工商银行－上证50交易型开放式指数证券投资基金;持股数量：28,991,381;持股比例：0.13%","股东名称：中国农业银行股份有限公司－富国中证国有企业改革指数分级证券投资基金;持股数量：26,178,750;持股比例：0.12%","股东名称：中国银行股份有限公司－嘉实沪深300交易型开放式指数证券投资基金;持股数量：24,898,250;持股比例：0.11%","股东名称：南方东英资产管理有限公司－南方富时中国A50ETF;持股数量：19,625,476;持股比例：0.09%"
600019,宝钢股份,"股东名称：宝钢集团有限公司;持股数量：13,128,825,267;持股比例：79.71%","股东名称：香港中央结算有限公司;持股数量：73,917,685;持股比例：0.45%","股东名称：招商银行股份有限公司－光大保德信优势配置股票型证券投资基金;持股数量：42,000,000;持股比例：0.26%","股东名称：平安养老保险股份有限公司－平安养老富盈人生养老保障委托管理产品富盈股票型组合;持股数量：35,702,752;持股比例：0.22%","股东名称：南方东英资产管理有限公司－南方富时中国A50ETF;持股数量：32,666,143;持股比例：0.2%","股东名称：郑彩萍;持股数量：31,396,712;持股比例：0.19%","股东名称：中国银河证券股份有限公司客户信用交易担保证券账户;持股数量：29,597,459;持股比例：0.18%","股东名称：中国银行－华夏回报证券投资基金;持股数量：27,801,716;持股比例：0.17%","股东名称：招商证券股份有限公司客户信用交易担保证券账户;持股数量：27,061,877;持股比例：0.16%","股东名称：中国银行股份有限公司－嘉实沪深300交易型开放式指数证券投资基金;持股数量：27,037,682;持股比例：0.16%"
600020,中原高速,"股东名称：河南交通投资集团有限公司;持股数量：1,013,313,285;持股比例：45.09%","股东名称：招商局华建公路投资有限公司;持股数量：449,560,546;持股比例：20%","股东名称：杨美芳;持股数量：3,120,200;持股比例：0.14%","股东名称：王生燕;持股数量：2,424,094;持股比例：0.11%","股东名称：中国光大银行股份有限公司－光大保德信量化核心证券投资基金;持股数量：2,369,555;持股比例：0.11%","股东名称：田一夫;持股数量：2,421,036;持股比例：0.11%","股东名称：金宝山;持股数量：2,388,569;持股比例：0.11%","股东名称：毛洪瑞;持股数量：2,192,820;持股比例：0.1%","股东名称：中融国际信托有限公司－鸿鑫木秀证券投资集合资金信托计划;持股数量：2,138,100;持股比例：0.1%","股东名称：徐顺发;持股数量：2,169,156;持股比例：0.1%"
600021,上海电力,"股东名称：中国电力投资集团公司;持股数量：916,646,315;持股比例：42.84%","股东名称：中国电力国际发展有限公司;持股数量：403,465,793;持股比例：18.86%","股东名称：中国长江电力股份有限公司;持股数量：171,474,696;持股比例：8.01%","股东名称：中国工商银行－博时第三产业成长股票证券投资基金;持股数量：17,999,965;持股比例：0.84%","股东名称：唐建华;持股数量：16,622,639;持股比例：0.78%","股东名称：钱小鹏;持股数量：12,015,500;持股比例：0.56%","股东名称：中国电能成套设备有限公司;持股数量：9,006,489;持股比例：0.42%","股东名称：全国社保基金六零一组合;持股数量：5,499,898;持股比例：0.26%","股东名称：中国银行股份有限公司－泰信蓝筹精选股票型证券投资基金;持股数量：4,810,000;持股比例：0.22%","股东名称：中国银行股份有限公司－长盛养老健康产业灵活配置混合型证券投资基金;持股数量：4,199,632;持股比例：0.2%"
600022,山东钢铁,"股东名称：济钢集团有限公司;持股数量：2,548,435,534;持股比例：39.59%","股东名称：莱芜钢铁集团有限公司;持股数量：2,355,115,523;持股比例：36.59%","股东名称：山东省国有资产投资控股有限公司;持股数量：48,333,846;持股比例：0.75%","股东名称：山东省经济开发投资公司;持股数量：25,762,755;持股比例：0.4%","股东名称：中国建设银行股份有限公司－中欧新蓝筹灵活配置混合型证券投资基金;持股数量：15,999,931;持股比例：0.25%","股东名称：兴业银行股份有限公司－中欧新趋势股票型证券投资基金(LOF);持股数量：15,999,915;持股比例：0.25%","股东名称：中国建设银行－长城品牌优选股票型证券投资基金;持股数量：13,286,100;持股比例：0.21%","股东名称：中信实业银行－招商优质成长股票型证券投资基金;持股数量：7,733,200;持股比例：0.12%","股东名称：陈霖;持股数量：7,321,072;持股比例：0.11%","股东名称：钟奇光;持股数量：6,046,209;持股比例：0.09%"
600026,中海发展,"股东名称：中国海运(集团)总公司;持股数量：1,436,608,100;持股比例：41.27%","股东名称：HKSCC NOMINEES LIMITED;持股数量：1,287,298,896;持股比例：36.98%","股东名称：武汉钢铁(集团)公司;持股数量：141,891,900;持股比例：4.08%","股东名称：中国银行－景顺长城鼎益股票型开放式证券投资基金;持股数量：13,998,340;持股比例：0.4%","股东名称：中国银行股份有限公司－华泰柏瑞积极成长混合型证券投资基金;持股数量：9,923,371;持股比例：0.29%","股东名称：中国银行－景顺长城动力平衡证券投资基金;持股数量：9,424,127;持股比例：0.27%","股东名称：黄碧君;持股数量：5,741,500;持股比例：0.16%","股东名称：中国农业银行－长盛同德主题增长股票型证券投资基金;持股数量：5,389,972;持股比例：0.15%","股东名称：新加坡科技资产管理有限公司－客户资金;持股数量：4,807,692;持股比例：0.14%","股东名称：中国工商银行股份有限公司－诺安灵活配置混合型证券投资基金;持股数量：4,599,362;持股比例：0.13%"
600027,华电国际,"股东名称：中国华电集团公司;持股数量：4,406,923,853;持股比例：50.04%","股东名称：香港中央结算（代理人）有限公司;持股数量：1,711,568,950;持股比例：19.43%","股东名称：山东省国际信托有限公司;持股数量：800,766,729;持股比例：9.09%","股东名称：上海电气集团股份有限公司;持股数量：80,000,005;持股比例：0.91%","股东名称：青岛华通国有资本运营（集团）有限责任公司;持股数量：68,000,000;持股比例：0.77%","股东名称：山东鲁能发展集团有限公司;持股数量：66,411,468;持股比例：0.75%","股东名称：国泰君安证券股份有限公司;持股数量：50,877,811;持股比例：0.58%","股东名称：光大证券股份有限公司客户信用交易担保证券账户;持股数量：49,327,499;持股比例：0.56%","股东名称：华泰证券股份有限公司客户信用交易担保证券账户;持股数量：47,247,932;持股比例：0.54%","股东名称：香港中央结算有限公司;持股数量：32,605,495;持股比例：0.37%"
600028,中国石化,"","","","","","","","","",""
600029,南方航空,"股东名称：中国南方航空集团公司;持股数量：4,208,586,278;持股比例：42.87%","股东名称：香港中央结算（代理人）有限公司;持股数量：1,745,649,197;持股比例：17.78%","股东名称：南龙控股有限公司;持股数量：1,033,650,000;持股比例：10.53%","股东名称：中航鑫港担保有限公司;持股数量：159,000,000;持股比例：1.62%","股东名称：赵晓东;持股数量：123,020,024;持股比例：1.25%","股东名称：芜湖瑞健投资咨询有限公司;持股数量：50,350,000;持股比例：0.51%","股东名称：中国银行股份有限公司－华泰柏瑞积极成长混合型证券投资基金;持股数量：34,145,990;持股比例：0.35%","股东名称：中国银行股份有限公司－嘉实沪深300交易型开放式指数证券投资基金;持股数量：19,209,426;持股比例：0.2%","股东名称：全国社保基金一一六组合;持股数量：18,803,880;持股比例：0.19%","股东名称：全国社保基金六零三组合;持股数量：17,999,929;持股比例：0.18%"
600030,中信证券,"股东名称：中国中信有限公司注1;持股数量：2,236,890,620;持股比例：20.3%","股东名称：香港中央结算（代理人）有限公司注2;持股数量：1,178,008,600;持股比例：10.69%","股东名称：中国人寿保险股份有限公司注3;持股数量：361,059,999;持股比例：3.28%","股东名称：中国人寿保险（集团）公司－传统－普通保险产品;持股数量：231,141,935;持股比例：2.1%","股东名称：中国工商银行股份有限公司－申万菱信申银万国证券行业指数分级证券投资基金;持股数量：194,872,583;持股比例：1.77%","股东名称：中国运载火箭技术研究院;持股数量：106,478,308;持股比例：0.97%","股东名称：香港中央结算有限公司注4;持股数量：95,636,736;持股比例：0.87%","股东名称：程道兴注5;持股数量：68,738,487;持股比例：0.62%","股东名称：中信国安集团有限公司;持股数量：58,353,128;持股比例：0.53%","股东名称：南京高科股份有限公司;持股数量：58,300,000;持股比例：0.53%"
600031,三一重工,"股东名称：三一集团有限公司;持股数量：3,827,795,612;持股比例：50.26%","股东名称：陈发树;持股数量：300,000,000;持股比例：3.94%","股东名称：梁稳根;持股数量：286,575,517;持股比例：3.76%","股东名称：上海朱雀珠玉橙投资中心（有限合伙）;持股数量：81,594,029;持股比例：1.07%","股东名称：向文波;持股数量：43,231,189;持股比例：0.57%","股东名称：唐修国;持股数量：41,284,115;持股比例：0.54%","股东名称：毛中吾;持股数量：40,173,190;持股比例：0.53%","股东名称：袁金华;持股数量：24,846,319;持股比例：0.34%","股东名称：泰康人寿保险股份有限公司－分红－个人分红－019L－FH002沪;持股数量：20,000,000;持股比例：0.26%","股东名称：中国银行股份有限公司－嘉实沪深300交易型开放式指数证券投资基金;持股数量：16,661,742;持股比例：0.22%"
