600287,江苏舜天,"股东名称：江苏舜天国际集团有限公司;持股数量：219,798,145;持股比例：50.32%","股东名称：中国建设银行－宝盈资源优选股票型证券投资基金;持股数量：8,090,100;持股比例：1.85%","股东名称：中国农业银行－宝盈策略增长股票型证券投资基金;持股数量：7,933,061;持股比例：1.82%","股东名称：银丰证券投资基金;持股数量：6,000,000;持股比例：1.37%","股东名称：中国建设银行－华宝兴业行业精选股票型证券投资基金;持股数量：5,197,995;持股比例：1.19%","股东名称：中国银行－南方高增长股票型开放式证券投资基金;持股数量：4,500,070;持股比例：1.03%","股东名称：中国银行－富兰克林国海潜力组合股票型证券投资基金;持股数量：3,500,661;持股比例：0.8%","股东名称：中国银行股份有限公司－招商行业领先股票型证券投资基金;持股数量：3,016,450;持股比例：0.69%","股东名称：中国农业银行－益民创新优势混合型证券投资基金;持股数量：2,917,400;持股比例：0.67%","股东名称：全国社保基金四零六组合;持股数量：2,760,975;持股比例：0.63%"
600288,大恒科技,"股东名称：郑素贞;持股数量：128,960,000;持股比例：29.52%","股东名称：上海浦东发展银行－广发小盘成长股票型证券投资基金;持股数量：9,529,352;持股比例：2.18%","股东名称：何雪萍;持股数量：7,823,304;持股比例：1.79%","股东名称：吴立新;持股数量：5,468,090;持股比例：1.25%","股东名称：中国新纪元有限公司;持股数量：5,000,000;持股比例：1.14%","股东名称：刘永;持股数量：1,345,000;持股比例：0.31%","股东名称：王戎;持股数量：1,331,000;持股比例：0.3%","股东名称：谭伟;持股数量：1,292,070;持股比例：0.3%","股东名称：李春元;持股数量：1,262,951;持股比例：0.29%","股东名称：云南国际信托有限公司－云信－华越集合资金信托计划;持股数量：1,229,600;持股比例：0.28%"
600289,亿阳信通,"股东名称：亿阳集团股份有限公司;持股数量：131,397,064;持股比例：23.16%","股东名称：北京北邮资产经营有限公司;持股数量：14,620,089;持股比例：2.58%","股东名称：郑涛;持股数量：3,500,000;持股比例：0.61%","股东名称：任红兵;持股数量：3,171,700;持股比例：0.56%","股东名称：盛伟;持股数量：3,150,000;持股比例：0.56%","股东名称：盛志明;持股数量：2,913,661;持股比例：0.51%","股东名称：李荣海;持股数量：2,517,100;持股比例：0.44%","股东名称：邵桥;持股数量：2,334,488;持股比例：0.41%","股东名称：盛妙芬;持股数量：2,240,300;持股比例：0.39%","股东名称：大成价值增长证券投资基金;持股数量：2,000,179;持股比例：0.35%"
600290,华仪电气,"股东名称：华仪电器集团有限公司;持股数量：184,002,500;持股比例：34.92%","股东名称：中源协和细胞基因工程股份有限公司;持股数量：6,861,774;持股比例：1.3%","股东名称：王仕孝;持股数量：6,711,764;持股比例：1.27%","股东名称：全国社保基金一零七组合;持股数量：5,799,930;持股比例：1.1%","股东名称：吴江电子仪器厂;持股数量：3,860,550;持股比例：0.73%","股东名称：中国银行股份有限公司－国投瑞银信息消费灵活配置混合型证券投资基金;持股数量：3,274,936;持股比例：0.62%","股东名称：华润深国投信托有限公司－福麟1号信托计划;持股数量：3,101,822;持股比例：0.59%","股东名称：戴艳霞;持股数量：2,806,470;持股比例：0.53%","股东名称：中国银行－华夏行业精选股票型证券投资基金(LOF);持股数量：2,645,796;持股比例：0.5%","股东名称：赵士军;持股数量：2,384,106;持股比例：0.45%"
600291,西水股份,"股东名称：北京新天地互动多媒体技术有限公司;持股数量：52,447,968;持股比例：13.66%","股东名称：乌海市城建投融资有限责任公司;持股数量：49,705,512;持股比例：12.94%","股东名称：上海德莱科技有限公司;持股数量：37,164,180;持股比例：9.68%","股东名称：许春辉;持股数量：7,396,630;持股比例：1.93%","股东名称：长春铁发实业有限公司;持股数量：7,143,837;持股比例：1.86%","股东名称：新时代证券有限责任公司;持股数量：5,290,176;持股比例：1.38%","股东名称：王志;持股数量：2,189,908;持股比例：0.57%","股东名称：全国社保基金四零二组合;持股数量：2,171,112;持股比例：0.57%","股东名称：华鑫国际信托有限公司－天时113号证券投资集合资金信托计划;持股数量：2,000,000;持股比例：0.52%","股东名称：新华信托股份有限公司－新华信托·磐石15号证券投资集合资金信托计划;持股数量：1,918,495;持股比例：0.5%"
600292,中电远达,"股东名称：中国电力投资集团公司;持股数量：261,784,928;持股比例：43.59%","股东名称：重庆市能源投资集团有限公司;持股数量：48,458,742;持股比例：8.07%","股东名称：交银施罗德资产－交通银行－交银施罗德资管进取1号资产管理计划;持股数量：17,231,947;持股比例：2.87%","股东名称：万家基金－民生银行－恒赢定增3号资产管理计划;持股数量：11,925,601;持股比例：1.99%","股东名称：新华基金－工商银行－中电远达定增2号资产管理计划;持股数量：9,682,769;持股比例：1.61%","股东名称：全国社保基金五零四组合;持股数量：9,026,258;持股比例：1.5%","股东名称：国开泰富基金－民生银行－国开泰富中商外贸定增1号资产管理计划;持股数量：9,026,258;持股比例：1.5%","股东名称：财通基金－工商银行－财通基金－富春定增17号资产管理计划;持股数量：8,916,849;持股比例：1.48%","股东名称：上海诚鼎德同股权投资基金有限公司;持股数量：6,370,623;持股比例：1.06%","股东名称：财通基金－工商银行－财通基金－富春定增15号资产管理计划;持股数量：6,291,028;持股比例：1.05%"
600293,三峡新材,"股东名称：当阳市国有资产管理局;持股数量：43,670,805;持股比例：12.68%","股东名称：海南宗宣达实业投资有限公司;持股数量：42,434,400;持股比例：12.32%","股东名称：当阳市国中安投资有限公司;持股数量：36,899,000;持股比例：10.71%","股东名称：吴东宜;持股数量：3,185,600;持股比例：0.92%","股东名称：王洛为;持股数量：2,871,944;持股比例：0.83%","股东名称：王壁楠;持股数量：2,651,878;持股比例：0.77%","股东名称：林爱清;持股数量：2,635,999;持股比例：0.76%","股东名称：伦嘉渝;持股数量：2,632,164;持股比例：0.76%","股东名称：刘凤宇;持股数量：2,388,200;持股比例：0.69%","股东名称：曹天安;持股数量：2,274,560;持股比例：0.66%"
600295,鄂尔多斯,"股东名称：内蒙古鄂尔多斯羊绒集团有限责任公司;持股数量：420,000,000;持股比例：40.7%","股东名称：鄂尔多斯资产管理（香港）有限公司;持股数量：58,116,695;持股比例：5.63%","股东名称：招商证券香港有限公司;持股数量：41,339,731;持股比例：4.01%","股东名称：中國光大證券（香港）有限公司;持股数量：12,124,738;持股比例：1.17%","股东名称：SKY ORIGIN LIMITED;持股数量：11,665,839;持股比例：1.13%","股东名称：贾铁斌;持股数量：9,145,314;持股比例：0.89%","股东名称：WISE STATELIMITED;持股数量：9,024,659;持股比例：0.87%","股东名称：SCBHK A/C BBH S/A VANGUARD
EMERGING MARKETS STOCK INDEX FUND;持股数量：7,746,615;持股比例：0.75%","股东名称：TOYO SECURITIES ASIA LTD. A/C
 CLIENT;持股数量：4,291,170;持股比例：0.42%","股东名称：国泰君安证券股份有限公司客户信用交易担保证券账户;持股数量：4,215,642;持股比例：0.41%"
600296,S兰铝,"","","","","","","","","",""
600297,美罗药业,"股东名称：美罗集团有限公司;持股数量：169,265,014;持股比例：48.36%","股东名称：中信证券股份有限公司？;持股数量：4,558,172;持股比例：1.3%","股东名称：中国民生银行股份有限公司－华商领先企业混合型证券投资基金;持股数量：4,290,000;持股比例：1.23%","股东名称：华润深国投信托有限公司－华润信托·润金125号集合资金信托计划;持股数量：3,043,189;持股比例：0.87%","股东名称：中国工商银行股份有限公司－长盛同益成长回报灵活配置混合型证券投资基金（LOF）？？？？？;持股数量：2,999,916;持股比例：0.86%","股东名称：长春铁发实业有限公司？？;持股数量：1,901,746;持股比例：0.54%","股东名称：厦门国际信托有限公司－浙商老友坤成二号新型结构化证券投资集合资金信托;持股数量：1,625,646;持股比例：0.46%","股东名称：中国工商银行股份有限公司－汇添富民营活力股票型证券投资基金？？？？;持股数量：1,499,910;持股比例：0.43%","股东名称：崔可欣？;持股数量：1,352,158;持股比例：0.39%","股东名称：李济杉？;持股数量：1,073,871;持股比例：0.31%"
600298,安琪酵母,"股东名称：湖北安琪生物集团有限公司;持股数量：129,761,668;持股比例：39.37%","股东名称：湖北日升科技有限公司;持股数量：34,646,577;持股比例：10.51%","股东名称：中国建设银行－银华富裕主题股票型证券投资基金;持股数量：6,552,785;持股比例：1.99%","股东名称：熊晴川;持股数量：2,972,090;持股比例：0.9%","股东名称：邦信资产管理有限公司;持股数量：2,800,000;持股比例：0.85%","股东名称：全国社保基金一零四组合;持股数量：2,699,848;持股比例：0.82%","股东名称：汪明英;持股数量：2,323,108;持股比例：0.7%","股东名称：林延秋;持股数量：1,427,200;持股比例：0.43%","股东名称：中国人寿保险股份有限公司－分红－个人分红－005L－FH002沪;持股数量：1,199,704;持股比例：0.36%","股东名称：王建国;持股数量：1,081,912;持股比例：0.33%"
600299,蓝星新材,"股东名称：中国蓝星（集团）股份有限公司;持股数量：282,045,298;持股比例：53.96%","股东名称：曹文桥;持股数量：4,092,000;持股比例：0.78%","股东名称：北京橡胶工业研究设计院;持股数量：3,737,262;持股比例：0.71%","股东名称：珠海鑫德物流有限公司;持股数量：3,547,020;持股比例：0.68%","股东名称：王桂英;持股数量：3,033,853;持股比例：0.58%","股东名称：林美松;持股数量：2,138,999;持股比例：0.41%","股东名称：相其军;持股数量：1,954,203;持股比例：0.37%","股东名称：房晓军;持股数量：1,867,200;持股比例：0.36%","股东名称：顾蓓;持股数量：1,738,060;持股比例：0.33%","股东名称：顾炎坤;持股数量：1,686,900;持股比例：0.32%"
600300,维维股份,"股东名称：维维集团股份有限公司;持股数量：532,896,113;持股比例：31.87%","股东名称：GIANT HARVEST LIMITED;持股数量：316,800,000;持股比例：18.95%","股东名称：大冢（中国）投资有限公司;持股数量：104,731,478;持股比例：6.26%","股东名称：何暄;持股数量：4,880,200;持股比例：0.29%","股东名称：陈建平;持股数量：4,400,000;持股比例：0.26%","股东名称：张桦;持股数量：4,301,200;持股比例：0.26%","股东名称：陈聪惠;持股数量：3,920,000;持股比例：0.23%","股东名称：王莉;持股数量：3,131,900;持股比例：0.19%","股东名称：张晓华;持股数量：2,737,881;持股比例：0.16%","股东名称：润木财富投资集团管理有限公司;持股数量：2,282,386;持股比例：0.14%"
600301,*ST南化,"股东名称：南宁化工集团有限公司;持股数量：75,248,058;持股比例：32%","股东名称：南宁产业投资有限责任公司;持股数量：4,462,509;持股比例：1.9%","股东名称：许静波;持股数量：1,893,600;持股比例：0.81%","股东名称：姜轶;持股数量：1,465,198;持股比例：0.62%","股东名称：贝凤珍;持股数量：1,429,301;持股比例：0.61%","股东名称：高雪萍;持股数量：1,420,010;持股比例：0.6%","股东名称：王春生;持股数量：1,375,901;持股比例：0.59%","股东名称：陈林妹;持股数量：1,281,900;持股比例：0.55%","股东名称：林基泳;持股数量：1,100,566;持股比例：0.49%","股东名称：马映卿;持股数量：1,080,602;持股比例：0.46%"
600302,标准股份,"股东名称：中国标准工业集团有限公司;持股数量：161,232,430;持股比例：46.6%","股东名称：谢慧明;持股数量：4,881,066;持股比例：1.41%","股东名称：魏静;持股数量：1,504,900;持股比例：0.43%","股东名称：中国工商银行股份有限公司－新华趋势领航股票型证券投资基金;持股数量：1,411,917;持股比例：0.41%","股东名称：陈小妹;持股数量：1,300,217;持股比例：0.38%","股东名称：李静;持股数量：1,277,500;持股比例：0.37%","股东名称：季南;持股数量：1,182,716;持股比例：0.34%","股东名称：西藏信托有限公司－诺德金8号伞形证券投资集合资金信托计划;持股数量：1,044,621;持股比例：0.3%","股东名称：李杰;持股数量：1,010,000;持股比例：0.29%","股东名称：卢中青;持股数量：976,775;持股比例：0.28%"
600303,曙光股份,"股东名称：辽宁曙光集团有限责任公司;持股数量：151,653,300;持股比例：24.44%","股东名称：殷洪光;持股数量：2,636,780;持股比例：0.43%","股东名称：王洪生;持股数量：2,479,000;持股比例：0.4%","股东名称：谢思远;持股数量：2,067,460;持股比例：0.33%","股东名称：谢君远;持股数量：1,995,200;持股比例：0.32%","股东名称：谢志远;持股数量：1,980,000;持股比例：0.32%","股东名称：金贯东;持股数量：1,970,100;持股比例：0.32%","股东名称：中融国际信托有限公司－中融－长城点击成金6号证券投资集合资金信托计划;持股数量：1,800,660;持股比例：0.29%","股东名称：中国光大银行股份有限公司－光大保德信量化核心证券投资;持股数量：1,771,808;持股比例：0.29%","股东名称：郭林;持股数量：1,794,800;持股比例：0.29%"
600305,恒顺醋业,"股东名称：江苏恒顺集团有限公司;持股数量：132,085,260;持股比例：43.83%","股东名称：中国工商银行－汇添富均衡增长股票型证券投资基金;持股数量：12,514,035;持股比例：4.15%","股东名称：江苏汇鸿国际集团资产管理有限公司;持股数量：8,000,000;持股比例：2.65%","股东名称：中国工商银行－国投瑞银核心企业股票型证券投资基金;持股数量：7,558,258;持股比例：2.51%","股东名称：万家共赢－浦发银行－万家共赢深圳1号资产管理计划;持股数量：7,000,000;持股比例：2.32%","股东名称：平安大华基金－平安银行－平安信托－平安财富·创赢一期66号集合资金信托计划;持股数量：6,000,000;持股比例：1.99%","股东名称：安徽省铁路建设投资基金有限公司;持股数量：6,000,000;持股比例：1.99%","股东名称：南京瑞森投资管理合伙企业（有限合伙）;持股数量：6,000,000;持股比例：1.99%","股东名称：中信证券股份有限公司;持股数量：6,000,000;持股比例：1.99%","股东名称：中国工商银行股份有限公司－诺安灵活配置混合型证券投资基金;持股数量：5,397,973;持股比例：1.79%"
600306,商业城,"股东名称：中兆投资管理有限公司;持股数量：52,048,427;持股比例：29.22%","股东名称：深圳市琪创能贸易有限公司;持股数量：22,290,664;持股比例：12.51%","股东名称：李欣立;持股数量：4,993,450;持股比例：2.8%","股东名称：沈阳中兴商业集团有限公司;持股数量：4,233,578;持股比例：2.38%","股东名称：喻志田;持股数量：2,264,200;持股比例：1.27%","股东名称：王爱香;持股数量：2,003,592;持股比例：1.12%","股东名称：王缨;持股数量：1,498,266;持股比例：0.84%","股东名称：孙杰;持股数量：1,370,000;持股比例：0.77%","股东名称：上海石金投资有限公司;持股数量：1,250,000;持股比例：0.7%","股东名称：陈学赓;持股数量：1,036,801;持股比例：0.58%"
600307,酒钢宏兴,"股东名称：酒泉钢铁(集团)有限责任公司;持股数量：3,425,910,150;持股比例：54.7%","股东名称：民生加银基金－民生银行－民生加银资产管理有限公司;持股数量：1,086,000,000;持股比例：17.34%","股东名称：工银瑞信基金－工商银行－工银瑞信投资管理有限公司;持股数量：651,600,000;持股比例：10.4%","股东名称：金元惠理基金公司－农行－国投信托金雕89号单一资金信托计划;持股数量：217,200,000;持股比例：3.47%","股东名称：农银汇理基金公司－农行－国投信托金雕90号单一资金信托计划;持股数量：217,200,000;持股比例：3.47%","股东名称：张贯军;持股数量：40,000,000;持股比例：0.64%","股东名称：张国殿;持股数量：32,000,000;持股比例：0.51%","股东名称：柳美珍;持股数量：10,291,615;持股比例：0.16%","股东名称：朱照荣;持股数量：5,600,000;持股比例：0.09%","股东名称：金川集团有限公司;持股数量：5,272,728;持股比例：0.08%"
600308,华泰股份,"股东名称：华泰集团有限公司;持股数量：401,490,831;持股比例：34.39%","股东名称：上海富林投资有限公司;持股数量：7,434,000;持股比例：0.64%","股东名称：黄国珍;持股数量：5,876,000;持股比例：0.5%","股东名称：吴绮绯;持股数量：5,202,700;持股比例：0.45%","股东名称：倪梅芳;持股数量：4,964,000;持股比例：0.43%","股东名称：廖晖;持股数量：4,770,400;持股比例：0.41%","股东名称：虞鸣亮;持股数量：4,138,204;持股比例：0.35%","股东名称：中融国际信托有限公司－涨乐2号结构化证券投资集合资金信托计划;持股数量：3,468,180;持股比例：0.3%","股东名称：山西晋城无烟煤矿业集团有限责任公司企业年金计划－中国工商银行股份有限公司;持股数量：3,276,200;持股比例：0.28%","股东名称：中融国际信托有限公司－融泰稳盈证券投资集合资金信托计划;持股数量：2,698,540;持股比例：0.23%"
600309,万华化学,"股东名称：万华实业集团有限公司;持股数量：1,091,880,317;持股比例：50.5%","股东名称：中国建设银行－鹏华价值优势股票型证券投资基金;持股数量：37,987,278;持股比例：1.76%","股东名称：中国工商银行－广发聚丰股票型证券投资基金;持股数量：24,400,120;持股比例：1.13%","股东名称：全国社保基金一一八组合;持股数量：21,175,623;持股比例：0.98%","股东名称：中国工商银行－广发大盘成长混合型证券投资基金;持股数量：21,000,094;持股比例：0.97%","股东名称：交通银行－富国天益价值证券投资基金;持股数量：20,309,072;持股比例：0.94%","股东名称：烟台冰轮股份有限公司;持股数量：20,000,000;持股比例：0.92%","股东名称：泰康人寿保险股份有限公司－万能－个险万能;持股数量：11,968,583;持股比例：0.55%","股东名称：中国银行－嘉实稳健开放式证券投资基金;持股数量：11,476,675;持股比例：0.53%","股东名称：挪威中央银行－自有资金;持股数量：11,005,946;持股比例：0.51%"
600310,桂东电力,"股东名称：广西正润发展集团有限公司;持股数量：138,049,330;持股比例：50.03%","股东名称：中国工商银行－嘉实策略增长混合型证券投资基金;持股数量：8,650,518;持股比例：3.14%","股东名称：沈振国;持股数量：6,621,595;持股比例：2.4%","股东名称：中国邮政储蓄银行有限责任公司－中欧中小盘股票型证券投资基金(LOF);持股数量：3,000,013;持股比例：1.09%","股东名称：全国社保基金一零七组合;持股数量：2,199,867;持股比例：0.8%","股东名称：中欧基金－招商银行－中欧增值资产管理计划;持股数量：2,007,369;持股比例：0.73%","股东名称：罗志文;持股数量：1,553,981;持股比例：0.56%","股东名称：应京;持股数量：1,380,000;持股比例：0.5%","股东名称：中国银行股份有限公司－工银瑞信医疗保健行业股票型证券投资基金;持股数量：1,318,791;持股比例：0.48%","股东名称：全国社保基金一一四组合;持股数量：1,109,969;持股比例：0.4%"
600311,荣华实业,"股东名称：武威荣华工贸有限公司;持股数量：108,976,734;持股比例：16.37%","股东名称：张少波;持股数量：6,629,506;持股比例：1%","股东名称：徐兆义;持股数量：5,114,938;持股比例：0.77%","股东名称：游俊;持股数量：3,517,924;持股比例：0.53%","股东名称：武威塑料包装有限公司;持股数量：2,550,000;持股比例：0.38%","股东名称：康健;持股数量：2,388,800;持股比例：0.36%","股东名称：谭文;持股数量：1,955,000;持股比例：0.29%","股东名称：马爱梅;持股数量：1,673,210;持股比例：0.25%","股东名称：薛梅琴;持股数量：1,653,078;持股比例：0.25%","股东名称：张志敏;持股数量：1,648,072;持股比例：0.25%"
600312,平高电气,"股东名称：平高集团有限公司;持股数量：522,518,944;持股比例：45.94%","股东名称：交通银行－华安策略优选股票型证券投资基金;持股数量：18,286,861;持股比例：1.61%","股东名称：中国工商银行－华安中小盘成长股票型证券投资基金;持股数量：16,000,000;持股比例：1.41%","股东名称：傅湘涛;持股数量：11,512,710;持股比例：1.01%","股东名称：全国社保基金一零四组合;持股数量：9,400,000;持股比例：0.83%","股东名称：中华联合财产保险股份有限公司－传统保险产品;持股数量：8,580,429;持股比例：0.75%","股东名称：前海人寿保险股份有限公司－自有资金华泰组合;持股数量：7,179,076;持股比例：0.63%","股东名称：南山人寿保险股份有限公司－自有资金;持股数量：5,192,300;持股比例：0.46%","股东名称：科威特政府投资局－自有资金;持股数量：4,307,613;持股比例：0.38%","股东名称：中国人寿保险(集团)公司－传统－普通保险产品;持股数量：3,764,269;持股比例：0.33%"
600313,中农资源,"股东名称：中国农垦（集团）总公司？;持股数量：100,100,000;持股比例：27.25%","股东名称：中国农业发展集团有限公司;持股数量：63,087,248;持股比例：17.18%","股东名称：中国农业银行－中邮核心成长股票型证券投资基金;持股数量：5,503,840;持股比例：1.5%","股东名称：全国社保基金四一七组合
;持股数量：4,955,909;持股比例：1.35%","股东名称：中国银行－景顺长城优选股票证券投资基金;持股数量：4,442,599;持股比例：1.21%","股东名称：银华基金－建设银行－中国人寿－中国人寿委托银华基金公司混合型组合;持股数量：4,308,937;持股比例：1.17%","股东名称：中国建设银行股份有限公司－华商新量化灵活配置混合型证券投资基金;持股数量：3,507,481;持股比例：0.95%","股东名称：吕涛;持股数量：2,624,744;持股比例：0.71%","股东名称：江苏瑞琦投资有限公司
;持股数量：2,230,000;持股比例：0.61%","股东名称：通用技术集团投资管理有限公司;持股数量：2,000,000;持股比例：0.54%"
600315,上海家化,"股东名称：上海家化（集团）有限公司;持股数量：182,449,233;持股比例：27.14%","股东名称：上海久事公司;持股数量：31,092,899;持股比例：4.62%","股东名称：香港中央结算有限公司;持股数量：18,885,416;持股比例：2.81%","股东名称：博时新兴成长股票型证券投资基金;持股数量：17,519,603;持股比例：2.61%","股东名称：全国社保基金六零四组合;持股数量：10,356,000;持股比例：1.54%","股东名称：CITIGROUP GLOBAL MARKETS LIMITED;持股数量：7,345,422;持股比例：1.09%","股东名称：UBS   AG;持股数量：7,070,580;持股比例：1.05%","股东名称：新华都实业集团股份有限公司;持股数量：6,903,990;持股比例：1.03%","股东名称：徐留胜;持股数量：6,200,000;持股比例：0.92%","股东名称：华商策略精选灵活配置混合型证券投资基金;持股数量：6,000,133;持股比例：0.89%"
