600821,津劝业,"股东名称：天津劝业华联集团有限公司;持股数量：62,860,456;持股比例：15.1%","股东名称：天津中商联控股有限公司;持股数量：35,009,088;持股比例：8.41%","股东名称：天津市国有资产经营有限责任公司   ;持股数量：6,920,000;持股比例：1.66%","股东名称：白存珍;持股数量：3,552,900;持股比例：0.85%","股东名称：阮琳  ;持股数量：2,142,500;持股比例：0.51%","股东名称：陈继红;持股数量：2,071,500;持股比例：0.5%","股东名称：王安成;持股数量：1,822,610;持股比例：0.44%","股东名称：浙商证券股份有限公司客户信用交易担保证券账户;持股数量：1,780,401;持股比例：0.43%","股东名称：国泰君安证券股份有限公司客户信用交易担保证券账户  ;持股数量：1,780,358;持股比例：0.43%","股东名称：华泰证券股份有限公司客户信用交易担保证券账户;持股数量：1,766,313;持股比例：0.42%"
600822,上海物贸,"股东名称：百联集团有限公司;持股数量：238,575,962;持股比例：48.1%","股东名称：鞠文善;持股数量：2,708,800;持股比例：0.55%","股东名称：中国银行股份有限公司－泰信蓝筹精选股票型证券投资基金;持股数量：1,690,000;持股比例：0.34%","股东名称：陈丽娟;持股数量：1,280,300;持股比例：0.26%","股东名称：中信信托有限责任公司－基金9号;持股数量：1,247,800;持股比例：0.25%","股东名称：陈天明;持股数量：1,203,603;持股比例：0.24%","股东名称：上海沪北物流发展有限公司;持股数量：1,098,075;持股比例：0.22%","股东名称：长春铁发实业有限公司;持股数量：805,600;持股比例：0.16%","股东名称：钱春铭;持股数量：772,610;持股比例：0.16%","股东名称：SOUTH  CHINA GROWTH FUND;持股数量：780,000;持股比例：0.16%"
600823,世茂股份,"股东名称：峰盈国际有限公司;持股数量：558,000,000;持股比例：47.59%","股东名称：上海世茂企业发展有限公司;持股数量：239,529,474;持股比例：20.43%","股东名称：上海世茂投资管理有限公司;持股数量：72,000,000;持股比例：6.14%","股东名称：上海市黄浦区国有资产监督管理委员会;持股数量：14,684,850;持股比例：1.25%","股东名称：上海浦东国有资产投资管理有限公司;持股数量：7,371,000;持股比例：0.63%","股东名称：全国社保基金一一一组合;持股数量：2,707,677;持股比例：0.23%","股东名称：兴业银行股份有限公司－广发中证百度百发策略100指数型证券投资基金;持股数量：2,256,949;持股比例：0.19%","股东名称：北京识心力通电子有限公司;持股数量：2,033,276;持股比例：0.17%","股东名称：中国银行股份有限公司－国泰国证房地产行业指数分级证券投资基金;持股数量：1,873,667;持股比例：0.16%","股东名称：中国银行股份有限公司－华泰柏瑞量化指数增强股票型证券投资基金;持股数量：1,560,294;持股比例：0.13%"
600824,益民集团,"股东名称：上海市黄浦区国有资产监督管理委员会;持股数量：342,913,774;持股比例：39.04%","股东名称：昝圣达;持股数量：30,000,000;持股比例：3.42%","股东名称：上海工艺美术有限公司;持股数量：5,624,812;持股比例：0.64%","股东名称：中融国际信托有限公司－中融增强78号;持股数量：4,737,000;持股比例：0.54%","股东名称：华商优势行业灵活配置混合型证券投资基金;持股数量：2,600,035;持股比例：0.3%","股东名称：朱丽红;持股数量：1,830,108;持股比例：0.21%","股东名称：中信信托有限责任公司－中信·融赢华泰3号伞形结构化证券投资集合资金信托计划;持股数量：1,641,736;持股比例：0.19%","股东名称：张凌云;持股数量：1,573,200;持股比例：0.18%","股东名称：吴其明;持股数量：1,550,000;持股比例：0.18%","股东名称：金海莲;持股数量：1,560,000;持股比例：0.18%"
600825,新华传媒,"股东名称：上海新华发行集团有限公司;持股数量：314,057,281;持股比例：30.06%","股东名称：上海报业集团;持股数量：245,486,319;持股比例：23.49%","股东名称：上海中润广告有限公司（参与融资融券）;持股数量：15,332,892;持股比例：1.47%","股东名称：上海九百(集团)有限公司;持股数量：8,286,480;持股比例：0.79%","股东名称：尹全（参与融资融券）;持股数量：3,202,700;持股比例：0.31%","股东名称：中国农业银行股份有限公司－富国中证国有企业改革指数分级证券投资基金;持股数量：3,005,902;持股比例：0.29%","股东名称：屈雄（参与融资融券）;持股数量：2,651,523;持股比例：0.25%","股东名称：吴关校（参与融资融券）;持股数量：2,452,060;持股比例：0.23%","股东名称：华联（集团）有限公司;持股数量：1,999,404;持股比例：0.19%","股东名称：孙祯祥（参与融资融券）;持股数量：1,810,900;持股比例：0.17%"
600826,兰生股份,"股东名称：上海兰生（集团）有限公司;持股数量：216,287,026;持股比例：51.42%","股东名称：李振宁;持股数量：6,505,705;持股比例：1.55%","股东名称：杨兴良;持股数量：3,993,656;持股比例：0.95%","股东名称：赵水花;持股数量：3,829,000;持股比例：0.91%","股东名称：中江国际信托股份有限公司－金狮160号资金信托合同;持股数量：3,819,215;持股比例：0.91%","股东名称：黄燕丽;持股数量：3,228,031;持股比例：0.77%","股东名称：顾育军;持股数量：2,363,833;持股比例：0.56%","股东名称：许世甫;持股数量：2,353,799;持股比例：0.56%","股东名称：海通证券股份有限公司;持股数量：2,000,000;持股比例：0.48%","股东名称：华夏成长证券投资基金;持股数量：2,000,000;持股比例：0.48%"
600827,友谊股份,"股东名称：百联集团有限公司;持股数量：752,275,570;持股比例：43.67%","股东名称：上海友谊复星(控股)有限公司;持股数量：98,921,224;持股比例：5.74%","股东名称：白玲玲;持股数量：12,671,884;持股比例：0.74%","股东名称：上海国际集团有限公司;持股数量：10,887,443;持股比例：0.63%","股东名称：MANULIFE GLOBAL
    FUND;持股数量：8,063,153;持股比例：0.47%","股东名称：SCHRODER  INTERNATIONAL SELECTION FUND;持股数量：7,802,700;持股比例：0.45%","股东名称：中国农业银行－中海分红增利混合型开放式证券投资基金;持股数量：7,486,444;持股比例：0.43%","股东名称：曾笑娥;持股数量：6,579,752;持股比例：0.38%","股东名称：中国农业银行股份有限公司－富国中证国有企业改革指数分级证券投资基金;持股数量：4,438,335;持股比例：0.26%","股东名称：NORGES BANK;持股数量：4,390,144;持股比例：0.25%"
600828,成商集团,"股东名称：深圳茂业商厦有限公司;持股数量：388,226,763;持股比例：68.06%","股东名称：何晓阳;持股数量：12,682,020;持股比例：2.22%","股东名称：胡金根;持股数量：1,481,728;持股比例：0.26%","股东名称：朱蓉;持股数量：1,420,900;持股比例：0.25%","股东名称：胡荣强;持股数量：1,189,000;持股比例：0.21%","股东名称：张宏涛;持股数量：1,092,241;持股比例：0.19%","股东名称：中国建设银行股份有限公司－摩根士丹利华鑫多因子精选策略股票型证券投资基金;持股数量：970,219;持股比例：0.17%","股东名称：中国银行－海富通收益增长证券投资基金;持股数量：886,500;持股比例：0.16%","股东名称：魏肖楠;持股数量：840,026;持股比例：0.15%","股东名称：未健;持股数量：827,407;持股比例：0.15%"
600829,三精制药,"股东名称：哈药集团股份有限公司;持股数量：433,894,354;持股比例：74.82%","股东名称：中国建设银行股份有限公司－鹏华医疗保健股票型证券投资基金;持股数量：8,803,333;持股比例：1.52%","股东名称：简炼炜;持股数量：4,000,000;持股比例：0.69%","股东名称：李莞生;持股数量：3,500,000;持股比例：0.6%","股东名称：中国工商银行股份有限公司－汇添富医药保健股票型证券投资基金;持股数量：2,779,894;持股比例：0.48%","股东名称：云南国际信托有限公司－金丝猴证券投资.瑞园;持股数量：2,752,200;持股比例：0.47%","股东名称：曾郁;持股数量：2,611,079;持股比例：0.45%","股东名称：陈友忠;持股数量：1,740,005;持股比例：0.3%","股东名称：中海信托股份有限公司－中海·海通创新1号证券投资结构化集合资金信托;持股数量：1,727,195;持股比例：0.3%","股东名称：中国光大银行股份有限公司－光大保德信量化核心证券投资;持股数量：1,630,796;持股比例：0.28%"
600830,香溢融通,"股东名称：浙江烟草投资管理有限责任公司;持股数量：54,710,381;持股比例：12.04%","股东名称：浙江香溢控股有限公司;持股数量：45,000,000;持股比例：9.9%","股东名称：中天发展控股集团有限公司;持股数量：22,881,625;持股比例：5.04%","股东名称：浙江中烟工业有限责任公司;持股数量：13,500,000;持股比例：2.97%","股东名称：宁波市郡庙企业总公司;持股数量：12,546,841;持股比例：2.76%","股东名称：宁波大红鹰投资有限公司;持股数量：5,460,000;持股比例：1.2%","股东名称：孙亚敏;持股数量：3,559,801;持股比例：0.78%","股东名称：浙江国信控股集团有限责任公司;持股数量：3,327,138;持股比例：0.73%","股东名称：刘宣伯;持股数量：2,446,518;持股比例：0.54%","股东名称：兴业银行股份有限公司－广发中证百度百发策略100指数型证券投资基金;持股数量：2,413,130;持股比例：0.53%"
600831,广电网络,"股东名称：陕西广播电视集团有限公司;持股数量：203,249,114;持股比例：36.07%","股东名称：彭文涛;持股数量：9,994,800;持股比例：1.77%","股东名称：银华核心价值优选股票型证券投资基金;持股数量：8,999,919;持股比例：1.6%","股东名称：广发稳健增长证券投资基金;持股数量：7,199,800;持股比例：1.28%","股东名称：国营黄河机器制造厂;持股数量：6,985,473;持股比例：1.24%","股东名称：新华人寿保险股份有限公司－分红－团体分红－018L－FH001沪;持股数量：4,999,863;持股比例：0.89%","股东名称：郑元然;持股数量：3,800,000;持股比例：0.67%","股东名称：郑晓青;持股数量：1,935,774;持股比例：0.34%","股东名称：钟楚平;持股数量：1,827,946;持股比例：0.32%","股东名称：朱志强;持股数量：1,718,004;持股比例：0.3%"
600832,东方明珠,"股东名称：上海文化广播影视集团有限公司;持股数量：1,762,804,966;持股比例：55.32%","股东名称：上海东亚(集团)有限公司;持股数量：54,709,660;持股比例：1.72%","股东名称：上海国际影视节中心;持股数量：45,213,821;持股比例：1.42%","股东名称：上海精文投资有限公司;持股数量：42,005,132;持股比例：1.32%","股东名称：上海《每周广播电视》报社;持股数量：21,018,784;持股比例：0.66%","股东名称：中国工商银行－上证50交易型开放式指数证券投资基金;持股数量：9,197,977;持股比例：0.29%","股东名称：中国银行股份有限公司－嘉实沪深300交易型开放式指数证券投资基金;持股数量：8,717,782;持股比例：0.27%","股东名称：中国工商银行股份有限公司－华泰柏瑞沪深300交易型开放式指数证券投资基金;持股数量：6,060,625;持股比例：0.19%","股东名称：中国工商银行股份有限公司－华夏沪深300交易型开放式指数证券投资基金;持股数量：5,564,800;持股比例：0.17%","股东名称：董丽琴;持股数量：4,050,000;持股比例：0.13%"
600833,第一医药,"股东名称：上海新路达商业（集团）有限公司;持股数量：52,185,126;持股比例：23.39%","股东名称：百联集团有限公司*;持股数量：44,504,485;持股比例：19.95%","股东名称：泰康人寿保险股份有限公司－分红－个人分红－019L－FH002沪;持股数量：4,174,973;持股比例：1.87%","股东名称：中国邮政储蓄银行有限责任公司－中欧中小盘股票型证券投资基金(LOF);持股数量：2,679,880;持股比例：1.2%","股东名称：陕西省国际信托股份有限公司－陕国投·如意2号定向投资集合资金信托计划;持股数量：2,200,000;持股比例：0.99%","股东名称：上海达安房产开发有限公司;持股数量：1,717,716;持股比例：0.77%","股东名称：华联（集团）有限公司;持股数量：1,331,583;持股比例：0.6%","股东名称：上海南上海商业房地产有限公司;持股数量：1,268,467;持股比例：0.57%","股东名称：陈月环;持股数量：1,112,900;持股比例：0.5%","股东名称：深圳市中跃投资有限公司;持股数量：1,087,765;持股比例：0.49%"
600834,申通地铁,"股东名称：上海申通地铁集团有限公司;持股数量：278,943,799;持股比例：58.43%","股东名称：上海城投控股股份有限公司;持股数量：8,334,469;持股比例：1.75%","股东名称：李常岭;持股数量：1,659,581;持股比例：0.35%","股东名称：石莹;持股数量：1,013,339;持股比例：0.21%","股东名称：王莲英;持股数量：983,049;持股比例：0.21%","股东名称：沈伟;持股数量：697,400;持股比例：0.15%","股东名称：崔宏军;持股数量：664,600;持股比例：0.14%","股东名称：曹金彩;持股数量：600,000;持股比例：0.13%","股东名称：蒋勇;持股数量：520,000;持股比例：0.11%","股东名称：北方国际信托股份有限公司-北方信托阳昊套利二号证券投资集合资金信托计划;持股数量：519,000;持股比例：0.11%"
600835,上海机电,"股东名称：上海电气集团股份有限公司;持股数量：484,220,364;持股比例：47.35%","股东名称：GREENWOODS CHINA ALPHA MASTER FUND;持股数量：9,829,105;持股比例：0.96%","股东名称：NORGES BANK;持股数量：8,127,771;持股比例：0.79%","股东名称：GIC PRIVATE LIMITED;持股数量：6,367,776;持股比例：0.62%","股东名称：SCBHK A/C VALUE PARTNERS CHINA GREENCHIP FUND LTD;持股数量：5,759,138;持股比例：0.56%","股东名称：招商银行股份有限公司－华富成长趋势股票型证券投资基金;持股数量：4,749,826;持股比例：0.46%","股东名称：SCBHK A/C BBH S/A VANGUARD EMERGING MARKETS STOCK INDEX FUND;持股数量：4,600,075;持股比例：0.45%","股东名称：全国社保基金一零六组合;持股数量：3,202,761;持股比例：0.31%","股东名称：中国建设银行股份有限公司－嘉实泰和混合型证券投资基金;持股数量：3,160,600;持股比例：0.31%","股东名称：GUOTAIJUNAN SECURITIES(HONGKONG)LIMITED;持股数量：2,772,889;持股比例：0.27%"
600836,界龙实业,"股东名称：上海界龙集团有限公司;持股数量：82,184,987;持股比例：26.21%","股东名称：中国农业银行－中海分红增利混合型开放式证券投资基金;持股数量：2,809,557;持股比例：0.9%","股东名称：葛海萍;持股数量：831,000;持股比例：0.27%","股东名称：洪朝晖;持股数量：713,301;持股比例：0.23%","股东名称：王希明;持股数量：681,159;持股比例：0.22%","股东名称：吴志强;持股数量：680,000;持股比例：0.22%","股东名称：曹仲辉;持股数量：656,200;持股比例：0.21%","股东名称：徐艾薇;持股数量：632,500;持股比例：0.2%","股东名称：中国工商银行股份有限公司－招商中小盘精选股票型证券投资基金;持股数量：623,300;持股比例：0.2%","股东名称：吴泽民;持股数量：631,100;持股比例：0.2%"
600837,海通证券,"股东名称：香港中央结算（代理人）有限公司;持股数量：1,492,177,100;持股比例：15.57%","股东名称：光明食品（集团）有限公司;持股数量：410,650,000;持股比例：4.28%","股东名称：上海海烟投资管理有限公司;持股数量：400,709,623;持股比例：4.18%","股东名称：申能(集团)有限公司;持股数量：322,162,086;持股比例：3.36%","股东名称：上海电气（集团）总公司;持股数量：278,967,457;持股比例：2.91%","股东名称：上海久事公司;持股数量：235,247,280;持股比例：2.45%","股东名称：上海友谊集团股份有限公司;持股数量：214,471,652;持股比例：2.24%","股东名称：文汇新民联合报业集团;持股数量：164,329,853;持股比例：1.71%","股东名称：中国工商银行股份有限公司－申万菱信申银万国证券行业指数分级证券投资基金;持股数量：152,947,065;持股比例：1.6%","股东名称：上海上实(集团)有限公司;持股数量：137,840,039;持股比例：1.44%"
600838,上海九百,"股东名称：上海九百（集团）有限公司;持股数量：78,540,608;持股比例：19.59%","股东名称：上海市静安区土地开发控股（集团）公司;持股数量：19,678,278;持股比例：4.91%","股东名称：上海锦迪城市建设开发有限公司;持股数量：8,106,107;持股比例：2.02%","股东名称：百联集团有限公司;持股数量：7,366,330;持股比例：1.84%","股东名称：上海国宏置业有限公司;持股数量：6,000,000;持股比例：1.5%","股东名称：交通银行股份有限公司－天治核心成长股票型证券投资基金;持股数量：3,499,496;持股比例：0.87%","股东名称：朱丽红;持股数量：2,829,656;持股比例：0.71%","股东名称：杨荣生;持股数量：2,737,004;持股比例：0.68%","股东名称：崔志国;持股数量：2,228,025;持股比例：0.56%","股东名称：郑福良;持股数量：1,670,000;持股比例：0.42%"
600839,四川长虹,"股东名称：四川长虹电子集团有限公司;持股数量：1,070,863,727;持股比例：23.2%","股东名称：孟令翠;持股数量：104,735,328;持股比例：2.27%","股东名称：张惠强;持股数量：52,975,462;持股比例：1.15%","股东名称：吴鸣霄;持股数量：51,129,096;持股比例：1.11%","股东名称：四川虹扬投资有限公司;持股数量：40,785,185;持股比例：0.88%","股东名称：邓贤杰;持股数量：32,072,427;持股比例：0.69%","股东名称：向晓晶;持股数量：28,600,000;持股比例：0.62%","股东名称：中国农业银行股份有限公司－富国中证国有企业改革指数分级证券投资基金;持股数量：21,248,577;持股比例：0.46%","股东名称：中国银行股份有限公司－嘉实沪深300交易型开放式指数证券投资基金;持股数量：20,201,677;持股比例：0.44%","股东名称：权雯;持股数量：18,000,000;持股比例：0.39%"
600840,新湖创业,"","","","","","","","","",""
600841,上柴股份,"股东名称：上海汽车集团股份有限公司;持股数量：416,452,530;持股比例：48.05%","股东名称：无锡威孚高科技集团股份有限公司;持股数量：23,680,000;持股比例：2.73%","股东名称：BOCHK INVESTMENT FUNDS-BOCHK CHINA GOLDEN DRAGON FUND;持股数量：9,299,206;持股比例：1.07%","股东名称：刘志强;持股数量：8,043,350;持股比例：0.93%","股东名称：中信证券股份有限公司;持股数量：7,970,000;持股比例：0.92%","股东名称：中国中投证券有限责任公司客户信用交易担保证券账户;持股数量：2,973,095;持股比例：0.34%","股东名称：THE LIBRA GREATER CHINA FUND LTD;持股数量：2,768,910;持股比例：0.32%","股东名称：VANGUARD TOTAL INTERNATIONAL STOCK INDEX FUND;持股数量：2,352,660;持股比例：0.27%","股东名称：赵洁;持股数量：2,150,000;持股比例：0.25%","股东名称：施阿迷;持股数量：2,136,883;持股比例：0.25%"
600842,中西药业,"","","","","","","","","",""
600843,上工申贝,"股东名称：上海市浦东新区国有资产监督管理委员会;持股数量：105,395,358;持股比例：19.21%","股东名称：中国长城资产管理公司;持股数量：22,200,000;持股比例：4.05%","股东名称：南京瑞森投资管理合伙企业（有限合伙）;持股数量：16,000,000;持股比例：2.92%","股东名称：东方证券股份有限公司;持股数量：11,100,000;持股比例：2.02%","股东名称：上海汽车集团财务有限责任公司;持股数量：11,100,000;持股比例：2.02%","股东名称：兴业全球基金－光大银行－定增2号（分级）特定多客户资产管理计划;持股数量：11,100,000;持股比例：2.02%","股东名称：上海国际集团资产管理有限公司;持股数量：10,968,033;持股比例：2%","股东名称：汇添富基金－兴业银行－添富－海富－定增双喜盛世1号资产管理计划;持股数量：9,700,000;持股比例：1.77%","股东名称：云南国际信托有限公司－云信成长2013-5号集合资金信托计划;持股数量：5,826,122;持股比例：1.06%","股东名称：汇添富基金－工商银行－外贸信托·恒盛定向增发投资集合资金信托;持股数量：5,700,000;持股比例：1.04%"
600844,丹化科技,"股东名称：江苏丹化集团有限责任公司;持股数量：146,798,427;持股比例：18.85%","股东名称：董荣亭;持股数量：36,131,535;持股比例：4.64%","股东名称：上海盛宇企业投资有限公司;持股数量：21,467,834;持股比例：2.76%","股东名称：李伟杨;持股数量：9,494,500;持股比例：1.22%","股东名称：BOCI SECURITIES LIMITED;持股数量：6,015,505;持股比例：0.77%","股东名称：招商证券香港有限公司;持股数量：5,763,345;持股比例：0.74%","股东名称：袁公民;持股数量：3,999,999;持股比例：0.51%","股东名称：董坤;持股数量：3,950,032;持股比例：0.51%","股东名称：李蕃;持股数量：3,564,700;持股比例：0.46%","股东名称：CHINA INTERNATIONAL CAPITAL CORPORATION HONG KONG SECURITIES LTD;持股数量：3,384,852;持股比例：0.43%"
600845,宝信软件,"股东名称：宝山钢铁股份有限公司;持股数量：202,106,819;持股比例：55.5%","股东名称：SHENYIN WANGUO NOMINEES (H.K.)
    LTD.;持股数量：9,548,458;持股比例：2.62%","股东名称：财通基金－上海银行－财通基金－富春48号资产管理计划;持股数量：5,126,700;持股比例：1.41%","股东名称：招商银行股份有限公司－华富成长趋势股票型证券投资基金;持股数量：2,747,700;持股比例：0.75%","股东名称：中国农业银行－国泰金牛创新成长股票型证券投资基金;持股数量：2,500,000;持股比例：0.69%","股东名称：GUOTAI JUNAN ECURITIES(HONGKONG) LIMITED;持股数量：2,323,288;持股比例：0.64%","股东名称：招商证券香港有限公司;持股数量：2,290,467;持股比例：0.63%","股东名称：全国社保基金一一二组合;持股数量：2,000,000;持股比例：0.55%","股东名称：华融国际信托有限责任公司－华融·彤源1号证券投资单一资金信托;持股数量：1,532,009;持股比例：0.42%","股东名称：MATTHEWS？ CHINA DIVIDEND FUND;持股数量：1,405,044;持股比例：0.39%"
600846,同济科技,"股东名称：上海同济资产经营有限公司;持股数量：146,051,849;持股比例：23.38%","股东名称：何雪萍;持股数量：3,000,000;持股比例：0.48%","股东名称：东方证券股份有限公司;持股数量：2,800,103;持股比例：0.45%","股东名称：潘珠彬;持股数量：2,097,216;持股比例：0.34%","股东名称：梁洁梅;持股数量：1,602,100;持股比例：0.26%","股东名称：宋旭东;持股数量：1,590,000;持股比例：0.25%","股东名称：香港中央结算有限公司;持股数量：1,488,480;持股比例：0.24%","股东名称：赵友良;持股数量：1,451,600;持股比例：0.23%","股东名称：姜东林;持股数量：1,400,000;持股比例：0.22%","股东名称：孙根;持股数量：1,263,200;持股比例：0.2%"
600847,万里股份,"股东名称：深圳市南方同正投资有限公司;持股数量：41,400,898;持股比例：26.29%","股东名称：重庆机电控股（集团）公司  ;持股数量：16,516,023;持股比例：10.49%","股东名称：全国社保基金一零九组合    ;持股数量：5,000,000;持股比例：3.17%","股东名称：何昌珍;持股数量：4,190,000;持股比例：2.66%","股东名称：中国工商银行－诺安股票证券投资基金;持股数量：4,071,940;持股比例：2.59%","股东名称：全国社保基金四一三组合;持股数量：4,040,000;持股比例：2.57%","股东名称：中国工商银行－诺安价值增长股票证券投资基金;持股数量：3,566,166;持股比例：2.26%","股东名称：欧海鹰;持股数量：3,421,000;持股比例：2.17%","股东名称：兴业国际信托有限公司－兴业泉州<2007-12号>资金信托;持股数量：2,912,194;持股比例：1.85%","股东名称：融通资本财富－光大银行－融通资本星汉9号资产管理计划   ;持股数量：2,810,000;持股比例：1.78%"
