600585,海螺水泥,"股东名称：海螺集团（注2）;持股数量：1,948,869,927;持股比例：36.78%","股东名称：香港中央结算（代理人）有限公司（注3）;持股数量：1,297,865,778;持股比例：24.49%","股东名称：海创投资（注4）;持股数量：286,713,246;持股比例：5.41%","股东名称：香港中央结算（代理人）有限公司（注3）;持股数量：88,166,778;持股比例：1.66%","股东名称：兴元资产管理有限公司－客户资金;持股数量：45,100,917;持股比例：0.85%","股东名称：瑞士信贷（香港）有限公司;持股数量：34,042,741;持股比例：0.64%","股东名称：GIC PRIVATE LIMITED;持股数量：31,198,785;持股比例：0.59%","股东名称：平安信托有限责任公司—海螺股权;持股数量：29,873,600;持股比例：0.56%","股东名称：MERRILL LYNCH INTERNATIONAL;持股数量：27,790,813;持股比例：0.52%","股东名称：国元证券（香港）有限公司—国元人民币稳定收益基金;持股数量：26,765,636;持股比例：0.51%"
600586,金晶科技,"股东名称：山东金晶节能玻璃有限公司;持股数量：457,635,278;持股比例：32.17%","股东名称：民生加银基金公司－民生－民生加银鑫牛定向增发2号分级资产管理计划;持股数量：43,999,224;持股比例：3.09%","股东名称：英大证券有限责任公司客户信用交易担保证券账户;持股数量：25,929,100;持股比例：1.82%","股东名称：航天科工财务有限责任公司;持股数量：24,683,300;持股比例：1.74%","股东名称：浙江天银投资有限公司;持股数量：18,600,000;持股比例：1.31%","股东名称：中国银河证券股份有限公司客户信用交易担保证券账户;持股数量：4,611,118;持股比例：0.32%","股东名称：华泰证券股份有限公司客户信用交易担保证券账户;持股数量：4,347,567;持股比例：0.31%","股东名称：方正证券股份有限公司客户信用交易担保证券账户;持股数量：4,105,176;持股比例：0.29%","股东名称：中国工商银行股份有限公司－招商大盘蓝筹股票型证券投资基金;持股数量：4,088,815;持股比例：0.29%","股东名称：国泰君安证券股份有限公司客户信用交易担保证券账户;持股数量：3,351,195;持股比例：0.24%"
600587,新华医疗,"股东名称：淄博矿业集团有限责任公司;持股数量：116,947,642;持股比例：29.01%","股东名称：全国社保基金一一二组合;持股数量：14,886,387;持股比例：3.69%","股东名称：新华人寿保险股份有限公司－分红－团体分红－018L－FH001沪;持股数量：10,562,302;持股比例：2.62%","股东名称：浙信安享（天津）投资管理中心（有限合伙）;持股数量：9,418,898;持股比例：2.34%","股东名称：中国农业银行－国泰金牛创新成长股票型证券投资基金;持股数量：8,497,610;持股比例：2.11%","股东名称：中国建设银行－国泰金马稳健回报证券投资基金;持股数量：6,245,958;持股比例：1.55%","股东名称：淄博市财政局;持股数量：5,751,408;持股比例：1.43%","股东名称：中国建设银行股份有限公司－国泰金鑫股票型证券投资基金;持股数量：5,315,700;持股比例：1.32%","股东名称：王波;持股数量：4,848,444;持股比例：1.2%","股东名称：中国工商银行股份有限公司－融通医疗保健行业股票型证券投资基金;持股数量：4,539,990;持股比例：1.13%"
600588,用友软件,"股东名称：北京用友科技有限公司;持股数量：344,366,435;持股比例：29.4%","股东名称：上海用友科技咨询有限公司;持股数量：151,713,718;持股比例：12.95%","股东名称：上海益倍管理咨询有限公司;持股数量：59,358,240;持股比例：5.07%","股东名称：北京用友企业管理研究所有限公司;持股数量：48,794,191;持股比例：4.17%","股东名称：上海优富信息咨询有限公司;持股数量：35,000,000;持股比例：2.99%","股东名称：刘世强;持股数量：26,520,022;持股比例：2.26%","股东名称：全国社保基金一一八组合;持股数量：17,032,795;持股比例：1.45%","股东名称：孟国兴;持股数量：14,812,234;持股比例：1.26%","股东名称：中国工商银行－易方达价值成长混合型证券投资基金;持股数量：11,802,502;持股比例：1.01%","股东名称：招商银行股份有限公司－光大保德信优势配置股票型证券投资基金;持股数量：10,000,000;持股比例：0.85%"
600589,广东榕泰,"股东名称：广东榕泰高级瓷具有限公司;持股数量：137,717,274;持股比例：22.89%","股东名称：揭阳市兴盛化工原料有限公司;持股数量：80,140,000;持股比例：13.32%","股东名称：中国建设银行股份有限公司－华商新量化灵活配置混合型证券投资基金;持股数量：8,158,172;持股比例：1.36%","股东名称：卢珍;持股数量：3,646,062;持股比例：0.61%","股东名称：山东省国际信托有限公司;持股数量：3,440,000;持股比例：0.57%","股东名称：华源投资有限公司;持股数量：2,200,000;持股比例：0.37%","股东名称：高凤洁;持股数量：1,750,000;持股比例：0.29%","股东名称：周育松;持股数量：1,490,000;持股比例：0.25%","股东名称：郑金星;持股数量：1,379,529;持股比例：0.23%","股东名称：朱妙福;持股数量：1,203,500;持股比例：0.2%"
600590,泰豪科技,"股东名称：同方股份有限公司;持股数量：103,424,845;持股比例：20.43%","股东名称：泰豪集团有限公司;持股数量：94,250,000;持股比例：18.61%","股东名称：江西赣能股份有限公司;持股数量：7,600,000;持股比例：1.5%","股东名称：全国社保基金一一五组合;持股数量：3,381,066;持股比例：0.67%","股东名称：招商银行股份有限公司－中邮核心主题股票型证券投资基金;持股数量：3,299,901;持股比例：0.65%","股东名称：中国建设银行－交银施罗德蓝筹股票证券投资基金;持股数量：3,237,913;持股比例：0.64%","股东名称：新时代信托股份有限公司－丰金20号集合资金信托计划;持股数量：3,100,000;持股比例：0.61%","股东名称：陶勇;持股数量：3,016,392;持股比例：0.6%","股东名称：华润深国投信托有限公司－智慧金128号集合资金信托计划;持股数量：3,000,055;持股比例：0.59%","股东名称：杨剑;持股数量：2,800,000;持股比例：0.55%"
600591,*ST上航,"","","","","","","","","",""
600592,龙溪股份,"股东名称：漳州市九龙江集团有限公司;持股数量：151,233,800;持股比例：37.85%","股东名称：国机资产管理公司;持股数量：17,696,300;持股比例：4.43%","股东名称：简放平;持股数量：2,360,050;持股比例：0.59%","股东名称：刘胜;持股数量：1,957,105;持股比例：0.49%","股东名称：蔡文华;持股数量：1,196,620;持股比例：0.3%","股东名称：窦美兰;持股数量：1,106,500;持股比例：0.28%","股东名称：胡元明;持股数量：1,100,971;持股比例：0.28%","股东名称：吕文杰;持股数量：1,009,533;持股比例：0.25%","股东名称：陈登光;持股数量：1,000,000;持股比例：0.25%","股东名称：刘沿阳;持股数量：956,900;持股比例：0.24%"
600593,大连圣亚,"股东名称：大连星海湾金融商务区投资管理股份有限公司;持股数量：22,104,000;持股比例：24.03%","股东名称：辽宁迈克集团股份有限公司;持股数量：7,400,000;持股比例：8.04%","股东名称：N.Z.UNDERWATER WORLD ENGINEERING AND DEVELOPMENT CO LIMITED;持股数量：7,368,000;持股比例：8.01%","股东名称：上海杉控投资有限公司;持股数量：2,650,000;持股比例：2.88%","股东名称：大连神洲游艺公司;持股数量：2,456,000;持股比例：2.67%","股东名称：时金莲;持股数量：2,069,759;持股比例：2.25%","股东名称：中国建设银行股份有限公司－汇添富消费行业股票型证券投资基金;持股数量：1,800,000;持股比例：1.96%","股东名称：周建平;持股数量：1,485,420;持股比例：1.61%","股东名称：中国建设银行股份有限公司－摩根士丹利华鑫多因子精选策略股票型证券投资基金;持股数量：841,987;持股比例：0.92%","股东名称：上海财通资产－光大银行－财通资产－钻石1号特定多个客户资产管理计划;持股数量：789,400;持股比例：0.86%"
600594,益佰制药,"股东名称：窦啟玲;持股数量：91,658,818;持股比例：23.15%","股东名称：中国工商银行－广发聚丰股票型证券投资基金;持股数量：12,935,579;持股比例：3.27%","股东名称：中国农业银行－长城安心回报混合型证券投资基金;持股数量：9,498,907;持股比例：2.4%","股东名称：中国工商银行－广发聚富开放式证券投资基金;持股数量：9,475,400;持股比例：2.39%","股东名称：全国社保基金一零二组合;持股数量：8,698,849;持股比例：2.2%","股东名称：哥伦比亚大学;持股数量：7,404,649;持股比例：1.87%","股东名称：朱岳兴;持股数量：7,088,847;持股比例：1.79%","股东名称：孙飏;持股数量：7,017,500;持股比例：1.77%","股东名称：甘宁;持股数量：6,542,669;持股比例：1.65%","股东名称：华夏资本－工商银行－华夏资本定向增发－远策1号资产管理计划;持股数量：5,741,600;持股比例：1.45%"
600595,中孚实业,"股东名称：河南豫联能源集团有限责任公司;持股数量：920,071,412;持股比例：52.83%","股东名称：国元证券股份有限公司;持股数量：61,000,000;持股比例：3.5%","股东名称：巩义市国有资产投资经营有限公司;持股数量：12,106,032;持股比例：0.7%","股东名称：刘仇艾;持股数量：2,874,531;持股比例：0.17%","股东名称：陈峥嵘;持股数量：2,810,910;持股比例：0.16%","股东名称：中国建设银行股份有限公司－中欧价值发现股票型证券投资基金;持股数量：2,774,700;持股比例：0.16%","股东名称：河南第一火电建设公司;持股数量：2,415,190;持股比例：0.14%","股东名称：中国工商银行股份有限公司－中欧价值智选回报混合型证券投资基金;持股数量：2,350,000;持股比例：0.13%","股东名称：方正证券股份有限公司客户信用交易担保证券账户;持股数量：2,179,861;持股比例：0.13%","股东名称：中国光大银行股份有限公司－中欧新动力股票型证券投资基金(LOF);持股数量：1,934,230;持股比例：0.11%"
600596,新安股份,"股东名称：传化集团有限公司;持股数量：101,725,800;持股比例：14.98%","股东名称：开化县国有资产经营有限责任公司;持股数量：48,756,136;持股比例：7.18%","股东名称：王伟;持股数量：17,629,359;持股比例：2.6%","股东名称：华夏银行股份有限公司－华商大盘量化精选灵活配置混合型证券投资基金;持股数量：9,443,320;持股比例：1.39%","股东名称：季诚建;持股数量：8,829,359;持股比例：1.3%","股东名称：刘侠;持股数量：4,451,700;持股比例：0.66%","股东名称：林加善;持股数量：4,429,359;持股比例：0.66%","股东名称：方江南;持股数量：4,400,000;持股比例：0.65%","股东名称：中化农化有限公司;持股数量：3,872,000;持股比例：0.57%","股东名称：中国光大银行股份有限公司－中欧新动力股票型证券投资基金(LOF);持股数量：3,669,901;持股比例：0.54%"
600597,光明乳业,"股东名称：上海牛奶（集团）有限公司;持股数量：366,498,967;持股比例：29.78%","股东名称：光明食品（集团）有限公司;持股数量：302,352,699;持股比例：24.57%","股东名称：邓佑衔;持股数量：19,481,398;持股比例：1.58%","股东名称：中国人民人寿保险股份有限公司－万能－个险万能;持股数量：14,762,329;持股比例：1.2%","股东名称：全国社保基金一一零组合;持股数量：13,766,639;持股比例：1.12%","股东名称：全国社保基金一零六组合;持股数量：13,559,110;持股比例：1.1%","股东名称：全国社保基金四一六组合;持股数量：6,799,915;持股比例：0.55%","股东名称：全国社保基金一零一组合;持股数量：5,656,924;持股比例：0.46%","股东名称：全国社保基金一一七组合;持股数量：5,000,000;持股比例：0.41%","股东名称：中国人民财产保险股份有限公司－传统－收益组合;持股数量：4,054,452;持股比例：0.33%"
600598,北大荒,"股东名称：黑龙江北大荒农垦集团总公司                                                      ;持股数量：1,140,262,121;持股比例：64.14%","股东名称：余明伟                                                                          ;持股数量：5,032,001;持股比例：0.28%","股东名称：BILL & MELINDA GATES FOUNDATION TRUST                                           ;持股数量：5,000,354;持股比例：0.28%","股东名称：招商银行股份有限公司－华富成长趋势股票型证券投资基金                            ;持股数量：4,160,000;持股比例：0.23%","股东名称：杨宗莉                                                                          ;持股数量：3,686,175;持股比例：0.21%","股东名称：胡元明                                                                          ;持股数量：3,684,036;持股比例：0.21%","股东名称：东北证券股份有限公司                                                            ;持股数量：3,560,077;持股比例：0.2%","股东名称：徐茂根                                                                          ;持股数量：3,463,435;持股比例：0.19%","股东名称：张连凤;持股数量：3,329,620;持股比例：0.19%","股东名称：朱晴波                                                                          ;持股数量：3,427,777;持股比例：0.19%"
600599,熊猫烟花,"股东名称：万载县银河湾投资有限公司;持股数量：40,000,000;持股比例：24.1%","股东名称：银河湾国际投资有限公司;持股数量：30,382,340;持股比例：18.3%","股东名称：东营国际金融贸易港有限公司;持股数量：9,930,475;持股比例：5.98%","股东名称：任智彪;持股数量：6,552,280;持股比例：3.95%","股东名称：冯继东;持股数量：852,900;持股比例：0.51%","股东名称：陶芝慧;持股数量：516,540;持股比例：0.31%","股东名称：郭劲松;持股数量：500,703;持股比例：0.3%","股东名称：涂江萍;持股数量：475,200;持股比例：0.29%","股东名称：刘连生;持股数量：376,800;持股比例：0.23%","股东名称：张亚军;持股数量：300,238;持股比例：0.18%"
600600,青岛啤酒,"股东名称：青岛啤酒集团有限公司;持股数量：413,067,555;持股比例：30.58%","股东名称：香港中央结算（代理人）有限公司;持股数量：373,879,441;持股比例：27.67%","股东名称：日本朝日集团控股株式会社;持股数量：270,127,836;持股比例：19.99%","股东名称：中国建银投资有限责任公司;持股数量：17,574,505;持股比例：1.3%","股东名称：中国人民人寿保险股份有限公司－分红－个险分红;持股数量：16,006,416;持股比例：1.18%","股东名称：泰康人寿保险股份有限公司－分红－个人分红－019L－FH002沪;持股数量：14,281,045;持股比例：1.06%","股东名称：高瓴资本管理有限公司－HCM中国基金;持股数量：9,326,142;持股比例：0.69%","股东名称：中国对外经济贸易信托有限公司－重阳对冲1号集合资金信托计划;持股数量：8,627,779;持股比例：0.64%","股东名称：上海重阳战略投资有限公司－重阳战略聚智基金;持股数量：7,535,243;持股比例：0.56%","股东名称：上海重阳战略投资有限公司－重阳战略汇智基金;持股数量：6,560,188;持股比例：0.49%"
600601,方正科技,"股东名称：北大方正信息产业集团有限公司;持股数量：255,613,016;持股比例：11.65%","股东名称：徐云华;持股数量：13,486,240;持股比例：0.61%","股东名称：李立志;持股数量：8,798,777;持股比例：0.4%","股东名称：天安财产保险股份有限公司－保赢1号;持股数量：7,999,941;持股比例：0.36%","股东名称：冯珊珊;持股数量：3,788,748;持股比例：0.17%","股东名称：张令玲;持股数量：3,679,800;持股比例：0.17%","股东名称：中国农业银行股份有限公司－中证500交易型开放式指数证券投资基金;持股数量：3,706,682;持股比例：0.17%","股东名称：杨令;持股数量：3,692,810;持股比例：0.17%","股东名称：彭靖寰;持股数量：3,155,900;持股比例：0.14%","股东名称：车进才;持股数量：3,041,800;持股比例：0.14%"
600602,仪电电子,"股东名称：上海仪电电子（集团）有限公司;持股数量：352,742,238;持股比例：30.07%","股东名称：上实置业集团（上海）有限公司;持股数量：8,693,397;持股比例：0.74%","股东名称：安淑华;持股数量：8,683,242;持股比例：0.74%","股东名称：黄海刚;持股数量：6,700,000;持股比例：0.57%","股东名称：WATTSBURG CO.LTD.;持股数量：4,400,558;持股比例：0.38%","股东名称：吴嘉毅;持股数量：4,060,000;持股比例：0.35%","股东名称：朱涛;持股数量：2,398,439;持股比例：0.2%","股东名称：康莉;持股数量：2,100,000;持股比例：0.18%","股东名称：黄心梓;持股数量：2,000,000;持股比例：0.17%","股东名称：VANGUARD TOTAL INTERNATIONAL
  STOCK INDEX FUND;持股数量：1,951,173;持股比例：0.17%"
600603,*ST兴业,"股东名称：陈铁铭;持股数量：8,819,014;持股比例：4.53%","股东名称：大洲控股集团有限公司;持股数量：8,794,396;持股比例：4.52%","股东名称：厦门新大洲商贸发展有限公司;持股数量：5,958,268;持股比例：3.06%","股东名称：中融国际信托有限公司－诺亚大成A股精选一号;持股数量：5,153,100;持股比例：2.65%","股东名称：厦门双润投资管理有限公司;持股数量：4,643,283;持股比例：2.39%","股东名称：吴海燕;持股数量：4,475,791;持股比例：2.3%","股东名称：曾平;持股数量：3,180,000;持股比例：1.63%","股东名称：李斯;持股数量：2,771,050;持股比例：1.42%","股东名称：李素珍;持股数量：2,583,089;持股比例：1.33%","股东名称：蒋玲艳;持股数量：1,692,386;持股比例：0.87%"
600604,市北高新,"股东名称：上海市北高新（集团）有限公司;持股数量：237,582,852;持股比例：41.94%","股东名称：SHENYIN WANGUO NOMINEES (H.K.) LTD.;持股数量：2,272,729;持股比例：0.4%","股东名称：曲辰;持股数量：2,200,000;持股比例：0.39%","股东名称：张俊秋;持股数量：1,947,700;持股比例：0.34%","股东名称：CHU WEN HUA;持股数量：1,362,600;持股比例：0.24%","股东名称：招商证券香港有限公司;持股数量：1,324,600;持股比例：0.23%","股东名称：CITIBANK NA H.K. S/A GOLDMAN SACHS INTERNATIONAL;持股数量：1,306,400;持股比例：0.23%","股东名称：GUOTAI JUNAN SECURITIES(HONGKONG) LIMITED;持股数量：1,200,000;持股比例：0.21%","股东名称：国元证券经纪（香港）有限公司;持股数量：1,061,500;持股比例：0.19%","股东名称：陈小敏;持股数量：1,060,000;持股比例：0.19%"
600605,汇通能源,"股东名称：上海弘昌晟集团有限公司;持股数量：48,373,895;持股比例：32.83%","股东名称：东方国际(集团)有限公司;持股数量：9,572,589;持股比例：6.5%","股东名称：鲍春玲;持股数量：4,191,896;持股比例：2.84%","股东名称：上海鸿伦投资有限公司;持股数量：3,979,561;持股比例：2.7%","股东名称：上海瀚新投资咨询有限公司;持股数量：3,693,209;持股比例：2.51%","股东名称：上海文洲投资咨询管理有限公司;持股数量：2,616,293;持股比例：1.78%","股东名称：华润深国投信托有限公司－非凡18号资金信托;持股数量：1,840,253;持股比例：1.25%","股东名称：刘文斌;持股数量：1,321,084;持股比例：0.9%","股东名称：华润深国投信托有限公司－非凡17号资金信托;持股数量：1,120,767;持股比例：0.76%","股东名称：楼剑锋;持股数量：988,650;持股比例：0.67%"
600606,金丰投资,"股东名称：上海地产（集团）有限公司;持股数量：201,958,120;持股比例：38.96%","股东名称：全国社保基金四一三组合;持股数量：11,589,158;持股比例：2.24%","股东名称：兴业银行股份有限公司－工银瑞信金融地产行业股票型证券投资基金;持股数量：8,560,668;持股比例：1.65%","股东名称：中诚信托有限责任公司－中诚·金谷1号集合资金信托;持股数量：6,569,434;持股比例：1.27%","股东名称：王恒;持股数量：4,392,628;持股比例：0.85%","股东名称：中国农业银行股份有限公司－工银瑞信高端制造行业股票型证券投资基金;持股数量：2,736,126;持股比例：0.53%","股东名称：中国银行股份有限公司－工银瑞信医疗保健行业股票型证券投资基金;持股数量：2,360,171;持股比例：0.46%","股东名称：谢华斌;持股数量：2,318,761;持股比例：0.45%","股东名称：罗瑞云;持股数量：2,253,392;持股比例：0.43%","股东名称：黄建伟;持股数量：2,228,100;持股比例：0.43%"
600607,上实医药,"","","","","","","","","",""
600608,上海科技,"股东名称：昆明市交通投资有限责任公司;持股数量：39,486,311;持股比例：12.01%","股东名称：昆明产业开发投资有限责任公司;持股数量：20,785,371;持股比例：6.32%","股东名称：吴鸣霄;持股数量：10,490,000;持股比例：3.19%","股东名称：马冬梅;持股数量：1,427,100;持股比例：0.43%","股东名称：陈嘉惠;持股数量：1,148,207;持股比例：0.35%","股东名称：新时代信托股份有限公司－龙腾一号证券投资集合资金信托计划;持股数量：1,111,013;持股比例：0.34%","股东名称：缪雪芳;持股数量：999,391;持股比例：0.3%","股东名称：肖东祥;持股数量：885,899;持股比例：0.27%","股东名称：杨明俊;持股数量：835,000;持股比例：0.25%","股东名称：黄素英;持股数量：767,500;持股比例：0.23%"
600609,金杯汽车,"股东名称：沈阳市汽车工业资产经营有限公司;持股数量：266,424,742;持股比例：24.38%","股东名称：沈阳新金杯投资有限公司;持股数量：97,983,033;持股比例：8.97%","股东名称：沈阳工业国有资产经营有限公司;持股数量：84,040,174;持股比例：7.69%","股东名称：中国第一汽车集团公司;持股数量：39,609,569;持股比例：3.63%","股东名称：上海申华控股股份有限公司;持股数量：34,770,000;持股比例：3.18%","股东名称：陈碗贞;持股数量：5,433,646;持股比例：0.5%","股东名称：陈积泽;持股数量：4,906,300;持股比例：0.45%","股东名称：林碧玲;持股数量：4,663,681;持股比例：0.43%","股东名称：费卫;持股数量：4,094,520;持股比例：0.37%","股东名称：唐永灵;持股数量：2,990,000;持股比例：0.27%"
600610,S中纺机,"股东名称：大申集团有限公司;持股数量：276,908,627;持股比例：25.85%","股东名称：南京弘昌资产管理有限公司;持股数量：174,130,605;持股比例：16.25%","股东名称：上海钱峰投资管理有限公司;持股数量：84,840,000;持股比例：7.92%","股东名称：上海中纺机职工技术开发经营服务公司;持股数量：10,663,956;持股比例：0.99%","股东名称：上海纺织发展总公司;持股数量：10,296,000;持股比例：0.96%","股东名称：上海南上海商业房地产有限公司;持股数量：10,296,000;持股比例：0.96%","股东名称：俞立明;持股数量：8,236,800;持股比例：0.76%","股东名称：上海轻工控股（集团）公司;持股数量：5,148,000;持股比例：0.48%","股东名称：上海申达股份有限公司;持股数量：5,148,000;持股比例：0.48%","股东名称：魏晋俊;持股数量：2,915,880;持股比例：0.27%"
600611,大众交通,"股东名称：上海大众公用事业（集团）股份有限公司;持股数量：327,179,412;持股比例：20.76%","股东名称：大众（香港）国际有限公司;持股数量：30,467,795;持股比例：1.93%","股东名称：Fretum Construction & Engineering Enterprise Limited;持股数量：27,733,990;持股比例：1.76%","股东名称：SCBHK A/C BBH S/A VANGUARD EMERGING MARKETS STOCK INDEX FUND;持股数量：11,357,506;持股比例：0.72%","股东名称：方国良;持股数量：5,618,155;持股比例：0.36%","股东名称：UBS AG LONDON BRANCH;持股数量：5,321,860;持股比例：0.34%","股东名称：谢建和;持股数量：3,620,000;持股比例：0.23%","股东名称：VANGUARD TOTAL INTERNATIONAL STOCK INDEX FUND;持股数量：3,582,600;持股比例：0.23%","股东名称：LIM ASIA MULTI-STRATEGY FUND INC;持股数量：3,124,489;持股比例：0.2%","股东名称：黄河;持股数量：2,561,000;持股比例：0.16%"
